{
  "batch_info": {
    "total_files": 10,
    "successful_files": 10,
    "failed_files": 0,
    "total_processing_time": 21.769399166107178,
    "timestamp": "2025-09-18 22:14:55"
  },
  "performance_metrics": {
    "throughput": 0.45936040419383833,
    "avg_processing_time": 7.446241927146912,
    "avg_confidence_score": 0.07383333333333333,
    "success_rate": 1.0,
    "total_documents_processed": 10,
    "total_processing_time": 21.769399166107178,
    "accuracy_metrics": {}
  },
  "individual_results": [
    {
      "file_path": "facturas_probar_modelo\\factura_10.png",
      "filename": "factura_10.png",
      "success": true,
      "processing_time": 7.810871362686157,
      "extracted_fields": {
        "razon_social_vendedor": "SysTech SA",
        "cuit_vendedor": "30-99999999-7",
        "razon_social_comprador": "Victoria Lopez",
        "cuit_comprador": "20-12345678-9",
        "condicion_iva_comprador": "Monotributista",
        "condicion_venta": "Contado",
        "fecha_emision": "27/04/2025",
        "subtotal": "22.980,00",
        "importe_total": "29.879,80",
        "iva": "4.825,80",
        "numero_factura": "38699066",
        "punto_venta": "0004",
        "tipo_factura": "A",
        "items": [
          {
            "codigo": "1",
            "descripcion": "Instalación servidores",
            "cantidad": "1",
            "unidad_medida": "unidad",
            "precio_unitario": "12.000,00",
            "importe_bonificacion": "1.920,00",
            "subtotal": "10.080,00"
          },
          {
            "codigo": "2",
            "descripcion": "Implementación red",
            "cantidad": "3",
            "unidad_medida": "unidad",
            "precio_unitario": "5.000,00",
            "importe_bonificacion": "2.100,00",
            "subtotal": "12.900,00"
          }
        ],
        "deuda_impositiva": "6.899,80"
      },
      "extracted_text": "ORIGINAL A SysTech SA saga] PASTURA Comp. Nro: 38699066 Punto de Venta: 0004 Fecha de Emisión: 27/04/2025         Razón Social: SysTech SA CUIT: 30-99999999-7 Domicilio Comercial:Figueroa Alcorta 750 Ingresos Brutos: 26602009991 Fecha de Inicio de Actividades: 01/01/2020 Condición frente al IVA: Responsable Inscripto 1/01/2025 Hasta: 31/12/2025 Fecha de Vto. para el pago: 30/04/2025     Período Facturado Desde: DNI: 20-12345678-9 Apellido y Nombre / Razón Social: Victoria Lopez Domicilio: Avenida Rivadavia 1200         Condición frente al IVA: Monotributista Condición de venta: Contado                               [ Producto / servicio — [u. — preciount [ont] imp. Bont. Subtotal 1 Instalación de servidores 1 unidad 12.000,00 16% 1.920,00 10.080,00 2 Implementación de red 3 unidad 5.000,00 14% 2.100,00 12.900,00   Percepción IIBB: $ 1.500,00 IVA: $4.825,80 Subtotal: $22.980,00 Importe Otros Tributos: $574,00 Importe Total: $29.879,80         5165247793596 Fecha de Vto. de CAE: 01/05/2025   Pág. 1/1   Comprobante Autorizado Esta Agencia no se responsabllza poros datos Ingrezados an l dea de a operacion",
      "confidence_score": 0.07333333333333333,
      "metrics": null,
      "metadata": {
        "file_size": 587472,
        "content_type": "image/jpeg",
        "text_blocks_count": 1,
        "tables_count": 0,
        "figures_count": 0
      }
    },
    {
      "file_path": "facturas_probar_modelo\\factura_11.png",
      "filename": "factura_11.png",
      "success": true,
      "processing_time": 8.00298285484314,
      "extracted_fields": {
        "razon_social_vendedor": "loud Innovations SRL",
        "cuit_vendedor": "30-99999999-7",
        "cuit_comprador": "20-12345678-9",
        "condicion_iva_comprador": "Monotributista",
        "condicion_venta": "Contado",
        "fecha_emision": "27/04/2025",
        "subtotal": "22.715,00",
        "importe_total": "29.678,15",
        "iva": "4.770,15",
        "numero_factura": "21242389",
        "punto_venta": "0004",
        "tipo_factura": "A",
        "items": [
          {
            "codigo": "2",
            "descripcion": "Instalación servidores",
            "cantidad": "1",
            "unidad_medida": "unidad",
            "precio_unitario": "12.000,00",
            "importe_bonificacion": "360,00",
            "subtotal": "11.640,00"
          },
          {
            "codigo": "3",
            "descripcion": "Capacitación",
            "cantidad": "1",
            "unidad_medida": "unidad",
            "precio_unitario": "5.000,00",
            "importe_bonificacion": "0,00",
            "subtotal": "5.000,00"
          }
        ],
        "deuda_impositiva": "6.963,15"
      },
      "extracted_text": "ORIGINAL Cloud Innovations SRL Le PAGTURA         Punto de Venta: 0004 Comp. Nro: 21242389 Razón Social: Cloud Innovations SRL Fecha de Emisión: 27/04/2025 CUIT: 30-99999999-7 Ingresos Brutos: 23138148818 Fecha de Inicio de Actividades: 01/01/2020 Domicilio Comercial:Calle 25 de Mayo 950 Condición frente al IVA: Responsable Inscripto 1/01/2025 Hasta: 31/12/2025 Fecha de Vto. para el pago: 30/04/2025     Período Facturado Desde: DNI: 20-12345678-9 Apellido y Nombre / Razón Social: Francisco Diaz Domlelllo: Cabildo 1000         Condición frente al IVA: Monotributista Condición de venta: Contado                                           [ Producto / servicio Ju. medida] Precioun [Bont] imp. Bont. Subtotal 1 Consultoría en IT. 1 unidad 7.500,00 19% 1.425,00 6.075,00 2 Instalación de servidores 1 unidad 12.000,00 3% 360,00 11.640,00 3 Capacitación 1 unidad 5.000,00 0% 0,00 5.000,00 Percepción IIBB: $ 1.500,00 IVA: $4.770,15 Subtotal: $22.715,00 Importe Otros Tributos: $693,00 Importe Total: $29.678,15 ARCA Pág. 1/1 5165247793596 Fecha de Vto. de CAE: 01/05/2025   Comprobante Autorizado Esta Agencia no se responsabllza poros datos Ingrezados an l dea de a operacion",
      "confidence_score": 0.07857142857142858,
      "metrics": null,
      "metadata": {
        "file_size": 593117,
        "content_type": "image/jpeg",
        "text_blocks_count": 1,
        "tables_count": 0,
        "figures_count": 0
      }
    },
    {
      "file_path": "facturas_probar_modelo\\factura_1.png",
      "filename": "factura_1.png",
      "success": true,
      "processing_time": 8.02538800239563,
      "extracted_fields": {
        "razon_social_vendedor": "Global Networks SRL",
        "cuit_vendedor": "30-99999999-7",
        "razon_social_comprador": "María Gonzalez",
        "cuit_comprador": "20-12345678-9",
        "condicion_iva_comprador": "Responsable Inscripto",
        "condicion_venta": "Contado",
        "fecha_emision": "27/04/2025",
        "subtotal": "36.380,00",
        "importe_total": "45.784,80",
        "iva": "7.639,80",
        "numero_factura": "88982595",
        "punto_venta": "0004",
        "tipo_factura": "A",
        "items": [
          {
            "codigo": "1",
            "descripcion": "Servicio consultoria",
            "cantidad": "1",
            "unidad_medida": "unidad",
            "precio_unitario": "10.000,00",
            "importe_bonificacion": "1.400,00",
            "subtotal": "8.600,00"
          },
          {
            "codigo": "2",
            "descripcion": "Desarrollo software",
            "cantidad": "2",
            "unidad_medida": "unidad",
            "precio_unitario": "8.000,00",
            "importe_bonificacion": "1.120,00",
            "subtotal": "14.880,00"
          }
        ],
        "deuda_impositiva": "9.404,80"
      },
      "extracted_text": "ORIGINAL                     Global Networks SRL co0.001 Punto de Venta: 0004 Comp. Nro: 88982595 Razón Social: Global Networks SRL Fecha de Emisión: 27/04/2025 Domicilio Comercial:Calle Salta 600 CUIT: 30-99999999-7 Ingresos Brutos: 26928520538 Condición frente al IVA: Responsable Inscripto Fecha de Inicio de Actividades: 01/01/2020 Período Facturado Desde: 01/01/2025 Hasta: 31/12/2025 Fecha de Vto. para el pago: 30/04/2025 DNI: 20-12345678-9 Apellido y Nombre / Razón Social: María Gonzalez Condición frente al IVA: Responsable Inscripto Domicitio: San Juan 500 Condición de venta: Contado                               [ Producto / servicio Ju. medida] Precioun [Bont] imp. Bont. Subtotal 1 Servicio de consultoria 1 unidad 10.000,00 14% 1.400,00 8.600,00 2 Desarrollo de software 2 unidad 8.000,00 7% 1.120,00 14.880,00 3 Implementación de red y unidad 5.000,00 14% 2.100,00 12.900,00   Percepción IIBB: $ 1.500,00 IVA: $7.639,80 Subtotal: $36.380,00 Importe Otros Tributos: $265,00 Importe Total: $45.784,80             5165247793596 Fecha de Vto. de CAE: 01/05/2025 Pág. 1/1   Comprobante Autorizado Esta Agencia no se responsabllza poros datos Ingrezados an l dea de a operacion",
      "confidence_score": 0.07333333333333333,
      "metrics": null,
      "metadata": {
        "file_size": 597541,
        "content_type": "image/jpeg",
        "text_blocks_count": 1,
        "tables_count": 0,
        "figures_count": 0
      }
    },
    {
      "file_path": "facturas_probar_modelo\\factura_12.png",
      "filename": "factura_12.png",
      "success": true,
      "processing_time": 8.037709474563599,
      "extracted_fields": {
        "razon_social_vendedor": "Global Solutions SA",
        "cuit_vendedor": "30-99999999-7",
        "razon_social_comprador": "Carmen Sánchez",
        "cuit_comprador": "20-12345678-9",
        "condicion_iva_comprador": "Responsable Inscripto",
        "condicion_venta": "Contado",
        "fecha_emision": "27/04/2025",
        "subtotal": "20.310,00",
        "importe_total": "26.454,10",
        "iva": "4.265,10",
        "numero_factura": "11287299",
        "punto_venta": "0004",
        "tipo_factura": "A",
        "items": [
          {
            "codigo": "2",
            "descripcion": "Implementación red",
            "cantidad": "3",
            "unidad_medida": "unidad",
            "precio_unitario": "5.000,00",
            "importe_bonificacion": "3.000,00",
            "subtotal": "12.000,00"
          }
        ],
        "deuda_impositiva": "6.144,10"
      },
      "extracted_text": "ORIGINAL . A RA Global Solutions SA ens] Comp. Nro: 11287299 Punto de Venta: 0004 Fecha de Emisión: 27/04/2025         Razón Social: Global Solutions SA CUIT: 30-99999999-7 Ingresos Brutos: 27225518652 Fecha de Inicio de Actividades: 01/01/2020 Domicilio Comercial:Ruta 9 Km 45 Condición frente al IVA: Responsable Inscripto 1/01/2025 Hasta: 31/12/2025 Fecha de Vto. para el pago: 30/04/2025     Período Facturado Desde: DNI: 20-12345678-9 Apellido y Nombre / Razón Social: Carmen Sánchez Domicilio: Avenida Callao 700         Condición frente al IVA: Responsable Inscripto Condición de venta: Contado                               [ Producto / servicio — [u. — preciount [ont] imp. Bont. Subtotal 1 Mantenimiento mensual a, unidad 1.500,00 12% 540,00 3.960,00 2 Implementación de red 3 unidad 5.000,00 20% 3.000,00 12.000,00 3 Capacitación unidad 5.000,00 13% 650,00 4.350,00   Percepción IIBB: $ 1.500,00 IVA: $4.265,10 Subtotal: $20.310,00 Importe Otros Tributos: $379,00 Importe Total: $26.454,10         Pág. 1/1 5165247793596 ARCA Fecha de Vto. de CAE: 01/05/2025     Comprobante Autorizado Esta Agencia no se responsabllza poros datos Ingrezados an l dea de a operacion",
      "confidence_score": 0.07333333333333333,
      "metrics": null,
      "metadata": {
        "file_size": 594493,
        "content_type": "image/jpeg",
        "text_blocks_count": 1,
        "tables_count": 0,
        "figures_count": 0
      }
    },
    {
      "file_path": "facturas_probar_modelo\\factura_13.png",
      "filename": "factura_13.png",
      "success": true,
      "processing_time": 6.942400217056274,
      "extracted_fields": {
        "razon_social_vendedor": "Cloud Systems SA",
        "cuit_vendedor": "30-99999999-7",
        "razon_social_comprador": "Álvaro Fernandez",
        "cuit_comprador": "20-12345678-9",
        "condicion_iva_comprador": "Responsable Inscripto",
        "condicion_venta": "Contado",
        "fecha_emision": "27/04/2025",
        "subtotal": "5.640,00",
        "importe_total": "8.885,40",
        "iva": "1.184,40",
        "numero_factura": "55500345",
        "punto_venta": "0004",
        "tipo_factura": "A",
        "items": [
          {
            "codigo": "1",
            "descripcion": "Licencia software",
            "cantidad": "2",
            "unidad_medida": "unidad",
            "precio_unitario": "3.000,00",
            "importe_bonificacion": "360,00",
            "subtotal": "5.640,00"
          }
        ],
        "deuda_impositiva": "3.245,40"
      },
      "extracted_text": "ORIGINAL A Cloud Systems SA esas] FACTURA Comp. Nro: 55500345 Punto de Venta: 0004 Fecha de Emisión: 27/04/2025         Razón Social: Cloud Systems SA CUIT: 30-99999999-7 Ingresos Brutos: 28824052832 Fecha de Inicio de Actividades: 01/01/2020 Domicilio Comercial:Av. Siempre Viva 742 Condición frente al IVA: Responsable Inscripto 1/01/2025 Hasta: 31/12/2025 Fecha de Vto. para el pago: 30/04/2025     Período Facturado Desde: DNI: 20-12345678-9 Apellido y Nombre / Razón Social: Álvaro Fernandez Domicilio: Av. 9 de Julio 1200         Condición frente al IVA: Responsable Inscripto Condición de venta: Contado                               [ Producto / servicio | cantidad — Ju. medida] Precio unit. [Bon] — Bont. ‘Subtotal 1 Licencia software 2 unidad 3.000,00 6% 360,00 5.640,00   Percepción IIBB: $ 1.500,00 IVA: $ 1.184,40 Subtotal: $5.640,00 Importe Otros Tributos: $561,00 Importe Total: $8.885,40         5165247793596 Fecha de Vto. de CAE: 01/05/2025   Pág. 1/1   Comprobante Autorizado Esta Agencia no se responsabllza poros datos Ingrezados an l dea de a operacion",
      "confidence_score": 0.07333333333333333,
      "metrics": null,
      "metadata": {
        "file_size": 583638,
        "content_type": "image/jpeg",
        "text_blocks_count": 1,
        "tables_count": 0,
        "figures_count": 0
      }
    },
    {
      "file_path": "facturas_probar_modelo\\factura_15.png",
      "filename": "factura_15.png",
      "success": true,
      "processing_time": 7.109610319137573,
      "extracted_fields": {
        "razon_social_vendedor": "Digital Infrastructure SA",
        "cuit_vendedor": "30-99999999-7",
        "razon_social_comprador": "Infrastructure SA",
        "cuit_comprador": "20-12345678-9",
        "condicion_venta": "Contado",
        "fecha_emision": "27/04/2025",
        "subtotal": "4.320,00",
        "importe_total": "7.478,20",
        "iva": "907,20",
        "numero_factura": "29273729",
        "punto_venta": "0004",
        "tipo_factura": "A",
        "items": [
          {
            "codigo": "1",
            "descripcion": "Mantenimiento mensual",
            "cantidad": "3",
            "unidad_medida": "unidad",
            "precio_unitario": "1.500,00",
            "importe_bonificacion": "180,00",
            "subtotal": "4.320,00"
          }
        ],
        "deuda_impositiva": "3.158,20"
      },
      "extracted_text": "ORIGINAL e A Digital Infrastructure SA — FACTURA Comp. Nro: 29273729 Punto de Venta: 0004 Fecha de Emisión: 27/04/2025         Razón Social: Digital Infrastructure SA CUIT: 30-99999999-7 Ingresos Brutos: 20825220794 Fecha de Inicio de Actividades: 01/01/2020 Domicilio Comercial:San Juan 500 Condición frente al IVA: Responsable Inscripto                                           Período Facturado Desde: 01/01/2025 Hasta: 31/12/2025 Fecha de Vto. para el pago: 30/04/2025 DNI: 20-12345678-9 Apellido y Nombre / Razón Soclal: Pedro Fernández Condición frente al IVA: Responsable Inscripto Domicitio: San Telmo 250 Condición de venta: Contado [ Producto servicio — [u,mecida] — precioune —[xonit] imp. Bonte Subtotal 1 Mantenimiento mensual 3 unidad 1.500,00 4% 180,00 4.320,00   Percepción IIBB: $ 1.500,00 IVA: $907,20 Subtotal: $4.320,00 Importe Otros Tributos: $751,00 Importe Total: $7.478,20         5165247793596 Fecha de Vto. de CAE: 01/05/2025   Pág. 1/1   Comprobante Autorizado Esta Agencia no se responsabllza poros datos Ingrezados an l dea de a operacion",
      "confidence_score": 0.07857142857142858,
      "metrics": null,
      "metadata": {
        "file_size": 583937,
        "content_type": "image/jpeg",
        "text_blocks_count": 1,
        "tables_count": 0,
        "figures_count": 0
      }
    },
    {
      "file_path": "facturas_probar_modelo\\factura_16.png",
      "filename": "factura_16.png",
      "success": true,
      "processing_time": 7.618026494979858,
      "extracted_fields": {
        "razon_social_vendedor": "Smart Software Solutions SA",
        "cuit_vendedor": "30-99999999-7",
        "razon_social_comprador": "Ricardo Herrera",
        "cuit_comprador": "20-12345678-9",
        "condicion_iva_comprador": "Monotributista",
        "condicion_venta": "Contado",
        "fecha_emision": "27/04/2025",
        "subtotal": "28.700,00",
        "importe_total": "36.677,00",
        "iva": "6.027,00",
        "numero_factura": "23159971",
        "punto_venta": "0004",
        "tipo_factura": "A",
        "items": [
          {
            "codigo": "1",
            "descripcion": "Capacitación",
            "cantidad": "1",
            "unidad_medida": "unidad",
            "precio_unitario": "5.000,00",
            "importe_bonificacion": "600,00",
            "subtotal": "4.400,00"
          },
          {
            "codigo": "2",
            "descripcion": "Instalación servidores",
            "cantidad": "1",
            "unidad_medida": "unidad",
            "precio_unitario": "12.000,00",
            "importe_bonificacion": "0,00",
            "subtotal": "12.000,00"
          },
          {
            "codigo": "3",
            "descripcion": "Implementación red",
            "cantidad": "3",
            "unidad_medida": "unidad",
            "precio_unitario": "5.000,00",
            "importe_bonificacion": "2.700,00",
            "subtotal": "12300,00"
          }
        ],
        "deuda_impositiva": "7.977,00"
      },
      "extracted_text": "ORIGINAL A FACTURA Punto de Venta: 0004 Comp.Nro: 23159971 Fecha de Emisión: 27/04/2025     Razón Social: Smart Software Solutions SA CUIT: 30-99999999-7 Ingresos Brutos: 26074194194 Fecha de Inicio de Actividades: 01/01/2020 Domicilio Comercial:Avenida Callao 700 Condición frente al IVA: Responsable Inscripto           Período Facturado Desde: 01/01/2025 Hasta: 31/12/2025 Fecha de Vto. para el pago: 30/04/2025 DNI: 20-12345678-9 Apellido y Nombre / Razón Social: Ricardo Herrera Condición frente al IVA: Monotributista Domicilio: Calle 25 de Mayo 950 Condición de venta: Contado                               | producto / Servicio = “Cantidad [U.Medida| — PrecioUntt —— [%Boni| — Imp.Bonif. ‘Subtotal 1 Capacitación 1 unidad 5.000,00 12% 600,00 4.400,00 2 Instalación de servidores 1 unidad 12.000,00 0% 0,00 12.000,00 3 Implementación de red 3 unidad 5.000,00 18% 2.700,00 12300,00   Percepción IIBB: $ 1.500,00 IVA: $6.027,00 Subtotal: $28.700,00 Importe Otros Tributos: $450,00 Importe Total: $36.677,00           5165247793596 Fecha de Vto. de CAE: 01/05/2025 Pág. 1/1   Comprobante Autorizado Esta Agencia no se responsabllza poros datos Ingrezados an l dea de a operacion",
      "confidence_score": 0.07333333333333333,
      "metrics": null,
      "metadata": {
        "file_size": 595304,
        "content_type": "image/jpeg",
        "text_blocks_count": 1,
        "tables_count": 0,
        "figures_count": 0
      }
    },
    {
      "file_path": "facturas_probar_modelo\\factura_14.png",
      "filename": "factura_14.png",
      "success": true,
      "processing_time": 7.834121227264404,
      "extracted_fields": {
        "razon_social_vendedor": "Advanced Systems SRL",
        "cuit_vendedor": "30-99999999-7",
        "razon_social_comprador": "Systems SRL",
        "cuit_comprador": "20-12345678-9",
        "condicion_iva_comprador": "Responsable Inscripto",
        "condicion_venta": "Contado",
        "fecha_emision": "27/04/2025",
        "subtotal": "31.085,00",
        "importe_total": "39.236,85",
        "iva": "6.527,85",
        "numero_factura": "81752841",
        "punto_venta": "0004",
        "tipo_factura": "A",
        "items": [
          {
            "codigo": "1",
            "descripcion": "Consultoría IT",
            "cantidad": "1",
            "unidad_medida": "unidad",
            "precio_unitario": "7.500,00",
            "importe_bonificacion": "0,00",
            "subtotal": "7.500,00"
          },
          {
            "codigo": "2",
            "descripcion": "Mantenimiento mensual",
            "cantidad": "3",
            "unidad_medida": "unidad",
            "precio_unitario": "1.500,00",
            "importe_bonificacion": "315,00",
            "subtotal": "4.185,00"
          },
          {
            "codigo": "3",
            "descripcion": "Análisis datos",
            "cantidad": "4",
            "unidad_medida": "unidad",
            "precio_unitario": "4.000,00",
            "importe_bonificacion": "13.760,00",
            "subtotal": "4"
          }
        ],
        "deuda_impositiva": "8.151,85"
      },
      "extracted_text": "ORIGINAL   Razón Social: Advanced Systems SRL Domicilio Comercial:Calle Falsa 123 Período Facturado Desde: 01/01/2025 Advanced Systems SRL |coo.001 Condición frente al IVA: Responsable Inscripto A | FACTURA       Fecha de Emisión: 27/04/2025 CUIT: 30-99999999-7 Ingresos Brutos: 26849006237 Punto de Venta: 0004 Comp.Nro: 81752841 Fecha de Inicio de Actividades: 01/01/2020   Hasta: 31/12/2025 Fecha de Vto. para el pago: 30/04/2025         DNI: 20-12345678-9 Condición frente al IVA: Responsable Inscripto Condición de venta: Contado Apellido y Nombre / Razón Social: Alfredo Castro Domlelllo: Cabildo 1000                             a “Cantidad |U.Medida] Precio Unt. — imp.Bonit ‘Subtotal 1 Consultoría en IT 1 unidad 7.500,00 0% 0,00 7.500,00 2 Mantenimiento mensual 3 unidad 1.500,00 7% 315,00 4.185,00 3 Análisis de datos 4 unidad 4.000,00 14% 13.760,00 4 Licencia software 2 unidad 3.000,00 6% 360,00 5.640,00   Percepción IIBB: $ 1.500,00 IVA: $6.527,85 Subtotal: $31.085,00 Importe Otros Tributos: $124,00 Importe Total: $39.236,85             Comprobante Autorizado   Pág. 1/1   5165247793596 Fecha de Vto. de CAE: 01/05/2025 Esta Agencia no se responsabllza poros datos Ingrezados an l dea de a operacion",
      "confidence_score": 0.07333333333333333,
      "metrics": null,
      "metadata": {
        "file_size": 603560,
        "content_type": "image/jpeg",
        "text_blocks_count": 1,
        "tables_count": 0,
        "figures_count": 0
      }
    },
    {
      "file_path": "facturas_probar_modelo\\factura_17.png",
      "filename": "factura_17.png",
      "success": true,
      "processing_time": 6.448271036148071,
      "extracted_fields": {
        "razon_social_vendedor": "Tech Consulting SRL",
        "cuit_vendedor": "30-99999999-7",
        "razon_social_comprador": "Susana Ruiz",
        "cuit_comprador": "20-12345678-9",
        "condicion_iva_comprador": "Monotributista",
        "condicion_venta": "Contado",
        "fecha_emision": "27/04/2025",
        "subtotal": "26.160,00",
        "importe_total": "34.043,60",
        "numero_factura": "37642520",
        "punto_venta": "0004",
        "tipo_factura": "A",
        "items": [
          {
            "codigo": "1",
            "descripcion": "Capacitación",
            "cantidad": "1",
            "unidad_medida": "unidad",
            "precio_unitario": "5.000,00",
            "importe_bonificacion": "350,00",
            "subtotal": "4.650,00"
          },
          {
            "codigo": "3",
            "descripcion": "Instalación servidores",
            "cantidad": "1",
            "unidad_medida": "unidad",
            "precio_unitario": "12.000,00",
            "importe_bonificacion": "240,00",
            "subtotal": "11.760,00"
          },
          {
            "codigo": "4",
            "descripcion": "Licencia software",
            "cantidad": "2",
            "unidad_medida": "unidad",
            "precio_unitario": "3.000,00",
            "importe_bonificacion": "480,00",
            "subtotal": "5.520,00"
          }
        ],
        "deuda_impositiva": "7.883,60"
      },
      "extracted_text": "ORIGINAL   Tech Consulting SRL Razón Social: Tech Consulting SRL Domicilio Comercial:San Juan 500 Condición frente al IVA: Responsable Inscripto A coD.001   FACTURA     Punto de Venta: 0004 Comp.Nro: 37642520 Fecha de Emisión: 27/04/2025 CUIT: 30-99999999-7 Ingresos Brutos: 25760980237 Fecha de Inicio de Actividades: 01/01/2020   Período Facturado Desde: 01/01/2025 Hasta: 31/12/2025 Fecha de Vto. para el pago: 30/04/2025         DNI: 20-12345678-9 Condición frente al IVA: Monotributista Condición de venta: Contado Apellido y Nombre / Razón Social: Susana Ruiz Domicilio: Avenida San Juan 850                                               [ Producto / servicio a Cantidad — |U. Medida] PrecioUnit —|%Bonif]__ imp. Boni. ‘Subtotal 1 Capacitación 1 unidad 5.000,00 7% 350,00 4.650,00 2 Mantenimiento mensual 3 unidad — 1.500,00 6% 270,00 4.230,00 3 Instalación de servidores 1 unidad 12.000,00 2% 240,00 11.760,00 4 Licencia software 2 unidad 3.000,00 8% 480,00 5.520,00 Percepción IIB: $ 1.500,00 IVA: Subtotal: $26.160,00 Importe Otros Tributos: $890,00 Importe Total: $34.043,60 Pág. 1/1 5165247793596 Fecha de Vto. de CAE: 01/05/2025 Comprobante Autorizado   Esta Agencia no se responsabllza poros datos Ingrezados an l dea de a operacion",
      "confidence_score": 0.06785714285714287,
      "metrics": null,
      "metadata": {
        "file_size": 603092,
        "content_type": "image/jpeg",
        "text_blocks_count": 1,
        "tables_count": 0,
        "figures_count": 0
      }
    },
    {
      "file_path": "facturas_probar_modelo\\factura_18.png",
      "filename": "factura_18.png",
      "success": true,
      "processing_time": 6.633038282394409,
      "extracted_fields": {
        "razon_social_vendedor": "TechnoConsult SRL",
        "cuit_vendedor": "30-99999999-7",
        "razon_social_comprador": "TechnoConsult SRL",
        "cuit_comprador": "20-12345678-9",
        "condicion_iva_comprador": "Monotributista",
        "condicion_venta": "Contado",
        "fecha_emision": "27/04/2025",
        "subtotal": "33.340,00",
        "importe_total": "42.725,40",
        "iva": "7.001,40",
        "numero_factura": "66856535",
        "punto_venta": "0004",
        "tipo_factura": "A",
        "items": [
          {
            "codigo": "2",
            "descripcion": "Capacitación",
            "cantidad": "1",
            "unidad_medida": "unidad",
            "precio_unitario": "5.000,00",
            "importe_bonificacion": "900,00",
            "subtotal": "4.100,00"
          },
          {
            "codigo": "3",
            "descripcion": "Desarrollo software",
            "cantidad": "2",
            "unidad_medida": "unidad",
            "precio_unitario": "8.000,00",
            "importe_bonificacion": "1.760,00",
            "subtotal": "14.240,00"
          }
        ],
        "deuda_impositiva": "9.385,40"
      },
      "extracted_text": "ORIGINAL   TechnoConsult SRL Razón Social: TechnoConsult SRL Domicilio Comercial:Avenida Libertador 450 Condición frente al IVA: Responsable Inscripto   Período Facturado Desde: 01/01/2025   A coD.001 FACTURA Punto de Venta: 0004 Fecha de Emisión: 27/04/2025       CUIT: 30-99999999-7 Ingresos Brutos: 21213685885 Hasta: 31/12/2025 Comp. Nro: 66856535 Fecha de Inicio de Actividades: 01/01/2020 Fecha de Vto. para el pago: 30/04/2025         DNI: 20-12345678-9 Condición frente al IVA: Monotributista Condición de venta: Contado Apellido y Nombre / Razón Social: Javier Morales Domicitio: Calle Tucumán 700                                           [ Producto / servicio Ju. medida] Precioun [Bont] imp. Bont. Subtotal 1 Soporte técnico 5, unidad 2.000,00 10% 1.000,00 9.000,00 2 Capacitación 1 unidad 5.000,00 18% 900,00 4.100,00 3 Desarrollo de software 2 unidad 8.000,00 11% 1.760,00 14.240,00 4 Consultoría en IT. 1 unidad 7.500,00 20% 1.500,00 6.000,00 Percepción IIBB: $ 1.500,00 IVA: $7.001,40 Subtotal: $33.340,00 Importe Otros Tributos: $884,00 Importe Total: $42.725,40 Pág. 1/1 5165247793596   Comprobante Autorizado     Fecha de Vto. de CAE: 01/05/2025 Esta Agencia no se responsabllza poros datos Ingrezados an l dea de a operacion",
      "confidence_score": 0.07333333333333333,
      "metrics": null,
      "metadata": {
        "file_size": 601129,
        "content_type": "image/jpeg",
        "text_blocks_count": 1,
        "tables_count": 0,
        "figures_count": 0
      }
    }
  ]
}