{
  "batch_info": {
    "total_files": 25,
    "successful_files": 25,
    "failed_files": 0,
    "total_processing_time": 48.15202045440674,
    "timestamp": "2025-09-18 22:15:43"
  },
  "performance_metrics": {
    "throughput": 0.5191890135466178,
    "avg_processing_time": 6.996938781738281,
    "avg_confidence_score": 0.07198241758241758,
    "success_rate": 1.0,
    "total_documents_processed": 25,
    "total_processing_time": 48.15202045440674,
    "accuracy_metrics": {}
  },
  "individual_results": [
    {
      "file_path": "facturas_probar_modelo\\factura_10.png",
      "filename": "factura_10.png",
      "success": true,
      "processing_time": 6.841274976730347,
      "extracted_fields": {
        "razon_social_vendedor": "SysTech SA",
        "cuit_vendedor": "30-99999999-7",
        "razon_social_comprador": "Victoria Lopez",
        "cuit_comprador": "20-12345678-9",
        "condicion_iva_comprador": "Monotributista",
        "condicion_venta": "Contado",
        "fecha_emision": "27/04/2025",
        "subtotal": "22.980,00",
        "importe_total": "29.879,80",
        "iva": "4.825,80",
        "numero_factura": "38699066",
        "punto_venta": "0004",
        "tipo_factura": "A",
        "items": [
          {
            "codigo": "1",
            "descripcion": "Instalación servidores",
            "cantidad": "1",
            "unidad_medida": "unidad",
            "precio_unitario": "12.000,00",
            "importe_bonificacion": "1.920,00",
            "subtotal": "10.080,00"
          },
          {
            "codigo": "2",
            "descripcion": "Implementación red",
            "cantidad": "3",
            "unidad_medida": "unidad",
            "precio_unitario": "5.000,00",
            "importe_bonificacion": "2.100,00",
            "subtotal": "12.900,00"
          }
        ],
        "deuda_impositiva": "6.899,80"
      },
      "extracted_text": "ORIGINAL A SysTech SA saga] PASTURA Comp. Nro: 38699066 Punto de Venta: 0004 Fecha de Emisión: 27/04/2025         Razón Social: SysTech SA CUIT: 30-99999999-7 Domicilio Comercial:Figueroa Alcorta 750 Ingresos Brutos: 26602009991 Fecha de Inicio de Actividades: 01/01/2020 Condición frente al IVA: Responsable Inscripto 1/01/2025 Hasta: 31/12/2025 Fecha de Vto. para el pago: 30/04/2025     Período Facturado Desde: DNI: 20-12345678-9 Apellido y Nombre / Razón Social: Victoria Lopez Domicilio: Avenida Rivadavia 1200         Condición frente al IVA: Monotributista Condición de venta: Contado                               [ Producto / servicio — [u. — preciount [ont] imp. Bont. Subtotal 1 Instalación de servidores 1 unidad 12.000,00 16% 1.920,00 10.080,00 2 Implementación de red 3 unidad 5.000,00 14% 2.100,00 12.900,00   Percepción IIBB: $ 1.500,00 IVA: $4.825,80 Subtotal: $22.980,00 Importe Otros Tributos: $574,00 Importe Total: $29.879,80         5165247793596 Fecha de Vto. de CAE: 01/05/2025   Pág. 1/1   Comprobante Autorizado Esta Agencia no se responsabllza poros datos Ingrezados an l dea de a operacion",
      "confidence_score": 0.07333333333333333,
      "metrics": null,
      "metadata": {
        "file_size": 587472,
        "content_type": "image/jpeg",
        "text_blocks_count": 1,
        "tables_count": 0,
        "figures_count": 0
      }
    },
    {
      "file_path": "facturas_probar_modelo\\factura_12.png",
      "filename": "factura_12.png",
      "success": true,
      "processing_time": 7.197072744369507,
      "extracted_fields": {
        "razon_social_vendedor": "Global Solutions SA",
        "cuit_vendedor": "30-99999999-7",
        "razon_social_comprador": "Carmen Sánchez",
        "cuit_comprador": "20-12345678-9",
        "condicion_iva_comprador": "Responsable Inscripto",
        "condicion_venta": "Contado",
        "fecha_emision": "27/04/2025",
        "subtotal": "20.310,00",
        "importe_total": "26.454,10",
        "iva": "4.265,10",
        "numero_factura": "11287299",
        "punto_venta": "0004",
        "tipo_factura": "A",
        "items": [
          {
            "codigo": "2",
            "descripcion": "Implementación red",
            "cantidad": "3",
            "unidad_medida": "unidad",
            "precio_unitario": "5.000,00",
            "importe_bonificacion": "3.000,00",
            "subtotal": "12.000,00"
          }
        ],
        "deuda_impositiva": "6.144,10"
      },
      "extracted_text": "ORIGINAL . A RA Global Solutions SA ens] Comp. Nro: 11287299 Punto de Venta: 0004 Fecha de Emisión: 27/04/2025         Razón Social: Global Solutions SA CUIT: 30-99999999-7 Ingresos Brutos: 27225518652 Fecha de Inicio de Actividades: 01/01/2020 Domicilio Comercial:Ruta 9 Km 45 Condición frente al IVA: Responsable Inscripto 1/01/2025 Hasta: 31/12/2025 Fecha de Vto. para el pago: 30/04/2025     Período Facturado Desde: DNI: 20-12345678-9 Apellido y Nombre / Razón Social: Carmen Sánchez Domicilio: Avenida Callao 700         Condición frente al IVA: Responsable Inscripto Condición de venta: Contado                               [ Producto / servicio — [u. — preciount [ont] imp. Bont. Subtotal 1 Mantenimiento mensual a, unidad 1.500,00 12% 540,00 3.960,00 2 Implementación de red 3 unidad 5.000,00 20% 3.000,00 12.000,00 3 Capacitación unidad 5.000,00 13% 650,00 4.350,00   Percepción IIBB: $ 1.500,00 IVA: $4.265,10 Subtotal: $20.310,00 Importe Otros Tributos: $379,00 Importe Total: $26.454,10         Pág. 1/1 5165247793596 ARCA Fecha de Vto. de CAE: 01/05/2025     Comprobante Autorizado Esta Agencia no se responsabllza poros datos Ingrezados an l dea de a operacion",
      "confidence_score": 0.07333333333333333,
      "metrics": null,
      "metadata": {
        "file_size": 594493,
        "content_type": "image/jpeg",
        "text_blocks_count": 1,
        "tables_count": 0,
        "figures_count": 0
      }
    },
    {
      "file_path": "facturas_probar_modelo\\factura_1.png",
      "filename": "factura_1.png",
      "success": true,
      "processing_time": 7.309785842895508,
      "extracted_fields": {
        "razon_social_vendedor": "Global Networks SRL",
        "cuit_vendedor": "30-99999999-7",
        "razon_social_comprador": "María Gonzalez",
        "cuit_comprador": "20-12345678-9",
        "condicion_iva_comprador": "Responsable Inscripto",
        "condicion_venta": "Contado",
        "fecha_emision": "27/04/2025",
        "subtotal": "36.380,00",
        "importe_total": "45.784,80",
        "iva": "7.639,80",
        "numero_factura": "88982595",
        "punto_venta": "0004",
        "tipo_factura": "A",
        "items": [
          {
            "codigo": "1",
            "descripcion": "Servicio consultoria",
            "cantidad": "1",
            "unidad_medida": "unidad",
            "precio_unitario": "10.000,00",
            "importe_bonificacion": "1.400,00",
            "subtotal": "8.600,00"
          },
          {
            "codigo": "2",
            "descripcion": "Desarrollo software",
            "cantidad": "2",
            "unidad_medida": "unidad",
            "precio_unitario": "8.000,00",
            "importe_bonificacion": "1.120,00",
            "subtotal": "14.880,00"
          }
        ],
        "deuda_impositiva": "9.404,80"
      },
      "extracted_text": "ORIGINAL                     Global Networks SRL co0.001 Punto de Venta: 0004 Comp. Nro: 88982595 Razón Social: Global Networks SRL Fecha de Emisión: 27/04/2025 Domicilio Comercial:Calle Salta 600 CUIT: 30-99999999-7 Ingresos Brutos: 26928520538 Condición frente al IVA: Responsable Inscripto Fecha de Inicio de Actividades: 01/01/2020 Período Facturado Desde: 01/01/2025 Hasta: 31/12/2025 Fecha de Vto. para el pago: 30/04/2025 DNI: 20-12345678-9 Apellido y Nombre / Razón Social: María Gonzalez Condición frente al IVA: Responsable Inscripto Domicitio: San Juan 500 Condición de venta: Contado                               [ Producto / servicio Ju. medida] Precioun [Bont] imp. Bont. Subtotal 1 Servicio de consultoria 1 unidad 10.000,00 14% 1.400,00 8.600,00 2 Desarrollo de software 2 unidad 8.000,00 7% 1.120,00 14.880,00 3 Implementación de red y unidad 5.000,00 14% 2.100,00 12.900,00   Percepción IIBB: $ 1.500,00 IVA: $7.639,80 Subtotal: $36.380,00 Importe Otros Tributos: $265,00 Importe Total: $45.784,80             5165247793596 Fecha de Vto. de CAE: 01/05/2025 Pág. 1/1   Comprobante Autorizado Esta Agencia no se responsabllza poros datos Ingrezados an l dea de a operacion",
      "confidence_score": 0.07333333333333333,
      "metrics": null,
      "metadata": {
        "file_size": 597541,
        "content_type": "image/jpeg",
        "text_blocks_count": 1,
        "tables_count": 0,
        "figures_count": 0
      }
    },
    {
      "file_path": "facturas_probar_modelo\\factura_11.png",
      "filename": "factura_11.png",
      "success": true,
      "processing_time": 7.361005783081055,
      "extracted_fields": {
        "razon_social_vendedor": "loud Innovations SRL",
        "cuit_vendedor": "30-99999999-7",
        "cuit_comprador": "20-12345678-9",
        "condicion_iva_comprador": "Monotributista",
        "condicion_venta": "Contado",
        "fecha_emision": "27/04/2025",
        "subtotal": "22.715,00",
        "importe_total": "29.678,15",
        "iva": "4.770,15",
        "numero_factura": "21242389",
        "punto_venta": "0004",
        "tipo_factura": "A",
        "items": [
          {
            "codigo": "2",
            "descripcion": "Instalación servidores",
            "cantidad": "1",
            "unidad_medida": "unidad",
            "precio_unitario": "12.000,00",
            "importe_bonificacion": "360,00",
            "subtotal": "11.640,00"
          },
          {
            "codigo": "3",
            "descripcion": "Capacitación",
            "cantidad": "1",
            "unidad_medida": "unidad",
            "precio_unitario": "5.000,00",
            "importe_bonificacion": "0,00",
            "subtotal": "5.000,00"
          }
        ],
        "deuda_impositiva": "6.963,15"
      },
      "extracted_text": "ORIGINAL Cloud Innovations SRL Le PAGTURA         Punto de Venta: 0004 Comp. Nro: 21242389 Razón Social: Cloud Innovations SRL Fecha de Emisión: 27/04/2025 CUIT: 30-99999999-7 Ingresos Brutos: 23138148818 Fecha de Inicio de Actividades: 01/01/2020 Domicilio Comercial:Calle 25 de Mayo 950 Condición frente al IVA: Responsable Inscripto 1/01/2025 Hasta: 31/12/2025 Fecha de Vto. para el pago: 30/04/2025     Período Facturado Desde: DNI: 20-12345678-9 Apellido y Nombre / Razón Social: Francisco Diaz Domlelllo: Cabildo 1000         Condición frente al IVA: Monotributista Condición de venta: Contado                                           [ Producto / servicio Ju. medida] Precioun [Bont] imp. Bont. Subtotal 1 Consultoría en IT. 1 unidad 7.500,00 19% 1.425,00 6.075,00 2 Instalación de servidores 1 unidad 12.000,00 3% 360,00 11.640,00 3 Capacitación 1 unidad 5.000,00 0% 0,00 5.000,00 Percepción IIBB: $ 1.500,00 IVA: $4.770,15 Subtotal: $22.715,00 Importe Otros Tributos: $693,00 Importe Total: $29.678,15 ARCA Pág. 1/1 5165247793596 Fecha de Vto. de CAE: 01/05/2025   Comprobante Autorizado Esta Agencia no se responsabllza poros datos Ingrezados an l dea de a operacion",
      "confidence_score": 0.07857142857142858,
      "metrics": null,
      "metadata": {
        "file_size": 593117,
        "content_type": "image/jpeg",
        "text_blocks_count": 1,
        "tables_count": 0,
        "figures_count": 0
      }
    },
    {
      "file_path": "facturas_probar_modelo\\factura_13.png",
      "filename": "factura_13.png",
      "success": true,
      "processing_time": 6.5606889724731445,
      "extracted_fields": {
        "razon_social_vendedor": "Cloud Systems SA",
        "cuit_vendedor": "30-99999999-7",
        "razon_social_comprador": "Álvaro Fernandez",
        "cuit_comprador": "20-12345678-9",
        "condicion_iva_comprador": "Responsable Inscripto",
        "condicion_venta": "Contado",
        "fecha_emision": "27/04/2025",
        "subtotal": "5.640,00",
        "importe_total": "8.885,40",
        "iva": "1.184,40",
        "numero_factura": "55500345",
        "punto_venta": "0004",
        "tipo_factura": "A",
        "items": [
          {
            "codigo": "1",
            "descripcion": "Licencia software",
            "cantidad": "2",
            "unidad_medida": "unidad",
            "precio_unitario": "3.000,00",
            "importe_bonificacion": "360,00",
            "subtotal": "5.640,00"
          }
        ],
        "deuda_impositiva": "3.245,40"
      },
      "extracted_text": "ORIGINAL A Cloud Systems SA esas] FACTURA Comp. Nro: 55500345 Punto de Venta: 0004 Fecha de Emisión: 27/04/2025         Razón Social: Cloud Systems SA CUIT: 30-99999999-7 Ingresos Brutos: 28824052832 Fecha de Inicio de Actividades: 01/01/2020 Domicilio Comercial:Av. Siempre Viva 742 Condición frente al IVA: Responsable Inscripto 1/01/2025 Hasta: 31/12/2025 Fecha de Vto. para el pago: 30/04/2025     Período Facturado Desde: DNI: 20-12345678-9 Apellido y Nombre / Razón Social: Álvaro Fernandez Domicilio: Av. 9 de Julio 1200         Condición frente al IVA: Responsable Inscripto Condición de venta: Contado                               [ Producto / servicio | cantidad — Ju. medida] Precio unit. [Bon] — Bont. ‘Subtotal 1 Licencia software 2 unidad 3.000,00 6% 360,00 5.640,00   Percepción IIBB: $ 1.500,00 IVA: $ 1.184,40 Subtotal: $5.640,00 Importe Otros Tributos: $561,00 Importe Total: $8.885,40         5165247793596 Fecha de Vto. de CAE: 01/05/2025   Pág. 1/1   Comprobante Autorizado Esta Agencia no se responsabllza poros datos Ingrezados an l dea de a operacion",
      "confidence_score": 0.07333333333333333,
      "metrics": null,
      "metadata": {
        "file_size": 583638,
        "content_type": "image/jpeg",
        "text_blocks_count": 1,
        "tables_count": 0,
        "figures_count": 0
      }
    },
    {
      "file_path": "facturas_probar_modelo\\factura_15.png",
      "filename": "factura_15.png",
      "success": true,
      "processing_time": 6.850873231887817,
      "extracted_fields": {
        "razon_social_vendedor": "Digital Infrastructure SA",
        "cuit_vendedor": "30-99999999-7",
        "razon_social_comprador": "Infrastructure SA",
        "cuit_comprador": "20-12345678-9",
        "condicion_venta": "Contado",
        "fecha_emision": "27/04/2025",
        "subtotal": "4.320,00",
        "importe_total": "7.478,20",
        "iva": "907,20",
        "numero_factura": "29273729",
        "punto_venta": "0004",
        "tipo_factura": "A",
        "items": [
          {
            "codigo": "1",
            "descripcion": "Mantenimiento mensual",
            "cantidad": "3",
            "unidad_medida": "unidad",
            "precio_unitario": "1.500,00",
            "importe_bonificacion": "180,00",
            "subtotal": "4.320,00"
          }
        ],
        "deuda_impositiva": "3.158,20"
      },
      "extracted_text": "ORIGINAL e A Digital Infrastructure SA — FACTURA Comp. Nro: 29273729 Punto de Venta: 0004 Fecha de Emisión: 27/04/2025         Razón Social: Digital Infrastructure SA CUIT: 30-99999999-7 Ingresos Brutos: 20825220794 Fecha de Inicio de Actividades: 01/01/2020 Domicilio Comercial:San Juan 500 Condición frente al IVA: Responsable Inscripto                                           Período Facturado Desde: 01/01/2025 Hasta: 31/12/2025 Fecha de Vto. para el pago: 30/04/2025 DNI: 20-12345678-9 Apellido y Nombre / Razón Soclal: Pedro Fernández Condición frente al IVA: Responsable Inscripto Domicitio: San Telmo 250 Condición de venta: Contado [ Producto servicio — [u,mecida] — precioune —[xonit] imp. Bonte Subtotal 1 Mantenimiento mensual 3 unidad 1.500,00 4% 180,00 4.320,00   Percepción IIBB: $ 1.500,00 IVA: $907,20 Subtotal: $4.320,00 Importe Otros Tributos: $751,00 Importe Total: $7.478,20         5165247793596 Fecha de Vto. de CAE: 01/05/2025   Pág. 1/1   Comprobante Autorizado Esta Agencia no se responsabllza poros datos Ingrezados an l dea de a operacion",
      "confidence_score": 0.07857142857142858,
      "metrics": null,
      "metadata": {
        "file_size": 583937,
        "content_type": "image/jpeg",
        "text_blocks_count": 1,
        "tables_count": 0,
        "figures_count": 0
      }
    },
    {
      "file_path": "facturas_probar_modelo\\factura_16.png",
      "filename": "factura_16.png",
      "success": true,
      "processing_time": 7.450626850128174,
      "extracted_fields": {
        "razon_social_vendedor": "Smart Software Solutions SA",
        "cuit_vendedor": "30-99999999-7",
        "razon_social_comprador": "Ricardo Herrera",
        "cuit_comprador": "20-12345678-9",
        "condicion_iva_comprador": "Monotributista",
        "condicion_venta": "Contado",
        "fecha_emision": "27/04/2025",
        "subtotal": "28.700,00",
        "importe_total": "36.677,00",
        "iva": "6.027,00",
        "numero_factura": "23159971",
        "punto_venta": "0004",
        "tipo_factura": "A",
        "items": [
          {
            "codigo": "1",
            "descripcion": "Capacitación",
            "cantidad": "1",
            "unidad_medida": "unidad",
            "precio_unitario": "5.000,00",
            "importe_bonificacion": "600,00",
            "subtotal": "4.400,00"
          },
          {
            "codigo": "2",
            "descripcion": "Instalación servidores",
            "cantidad": "1",
            "unidad_medida": "unidad",
            "precio_unitario": "12.000,00",
            "importe_bonificacion": "0,00",
            "subtotal": "12.000,00"
          },
          {
            "codigo": "3",
            "descripcion": "Implementación red",
            "cantidad": "3",
            "unidad_medida": "unidad",
            "precio_unitario": "5.000,00",
            "importe_bonificacion": "2.700,00",
            "subtotal": "12300,00"
          }
        ],
        "deuda_impositiva": "7.977,00"
      },
      "extracted_text": "ORIGINAL A FACTURA Punto de Venta: 0004 Comp.Nro: 23159971 Fecha de Emisión: 27/04/2025     Razón Social: Smart Software Solutions SA CUIT: 30-99999999-7 Ingresos Brutos: 26074194194 Fecha de Inicio de Actividades: 01/01/2020 Domicilio Comercial:Avenida Callao 700 Condición frente al IVA: Responsable Inscripto           Período Facturado Desde: 01/01/2025 Hasta: 31/12/2025 Fecha de Vto. para el pago: 30/04/2025 DNI: 20-12345678-9 Apellido y Nombre / Razón Social: Ricardo Herrera Condición frente al IVA: Monotributista Domicilio: Calle 25 de Mayo 950 Condición de venta: Contado                               | producto / Servicio = “Cantidad [U.Medida| — PrecioUntt —— [%Boni| — Imp.Bonif. ‘Subtotal 1 Capacitación 1 unidad 5.000,00 12% 600,00 4.400,00 2 Instalación de servidores 1 unidad 12.000,00 0% 0,00 12.000,00 3 Implementación de red 3 unidad 5.000,00 18% 2.700,00 12300,00   Percepción IIBB: $ 1.500,00 IVA: $6.027,00 Subtotal: $28.700,00 Importe Otros Tributos: $450,00 Importe Total: $36.677,00           5165247793596 Fecha de Vto. de CAE: 01/05/2025 Pág. 1/1   Comprobante Autorizado Esta Agencia no se responsabllza poros datos Ingrezados an l dea de a operacion",
      "confidence_score": 0.07333333333333333,
      "metrics": null,
      "metadata": {
        "file_size": 595304,
        "content_type": "image/jpeg",
        "text_blocks_count": 1,
        "tables_count": 0,
        "figures_count": 0
      }
    },
    {
      "file_path": "facturas_probar_modelo\\factura_14.png",
      "filename": "factura_14.png",
      "success": true,
      "processing_time": 7.734033584594727,
      "extracted_fields": {
        "razon_social_vendedor": "Advanced Systems SRL",
        "cuit_vendedor": "30-99999999-7",
        "razon_social_comprador": "Systems SRL",
        "cuit_comprador": "20-12345678-9",
        "condicion_iva_comprador": "Responsable Inscripto",
        "condicion_venta": "Contado",
        "fecha_emision": "27/04/2025",
        "subtotal": "31.085,00",
        "importe_total": "39.236,85",
        "iva": "6.527,85",
        "numero_factura": "81752841",
        "punto_venta": "0004",
        "tipo_factura": "A",
        "items": [
          {
            "codigo": "1",
            "descripcion": "Consultoría IT",
            "cantidad": "1",
            "unidad_medida": "unidad",
            "precio_unitario": "7.500,00",
            "importe_bonificacion": "0,00",
            "subtotal": "7.500,00"
          },
          {
            "codigo": "2",
            "descripcion": "Mantenimiento mensual",
            "cantidad": "3",
            "unidad_medida": "unidad",
            "precio_unitario": "1.500,00",
            "importe_bonificacion": "315,00",
            "subtotal": "4.185,00"
          },
          {
            "codigo": "3",
            "descripcion": "Análisis datos",
            "cantidad": "4",
            "unidad_medida": "unidad",
            "precio_unitario": "4.000,00",
            "importe_bonificacion": "13.760,00",
            "subtotal": "4"
          }
        ],
        "deuda_impositiva": "8.151,85"
      },
      "extracted_text": "ORIGINAL   Razón Social: Advanced Systems SRL Domicilio Comercial:Calle Falsa 123 Período Facturado Desde: 01/01/2025 Advanced Systems SRL |coo.001 Condición frente al IVA: Responsable Inscripto A | FACTURA       Fecha de Emisión: 27/04/2025 CUIT: 30-99999999-7 Ingresos Brutos: 26849006237 Punto de Venta: 0004 Comp.Nro: 81752841 Fecha de Inicio de Actividades: 01/01/2020   Hasta: 31/12/2025 Fecha de Vto. para el pago: 30/04/2025         DNI: 20-12345678-9 Condición frente al IVA: Responsable Inscripto Condición de venta: Contado Apellido y Nombre / Razón Social: Alfredo Castro Domlelllo: Cabildo 1000                             a “Cantidad |U.Medida] Precio Unt. — imp.Bonit ‘Subtotal 1 Consultoría en IT 1 unidad 7.500,00 0% 0,00 7.500,00 2 Mantenimiento mensual 3 unidad 1.500,00 7% 315,00 4.185,00 3 Análisis de datos 4 unidad 4.000,00 14% 13.760,00 4 Licencia software 2 unidad 3.000,00 6% 360,00 5.640,00   Percepción IIBB: $ 1.500,00 IVA: $6.527,85 Subtotal: $31.085,00 Importe Otros Tributos: $124,00 Importe Total: $39.236,85             Comprobante Autorizado   Pág. 1/1   5165247793596 Fecha de Vto. de CAE: 01/05/2025 Esta Agencia no se responsabllza poros datos Ingrezados an l dea de a operacion",
      "confidence_score": 0.07333333333333333,
      "metrics": null,
      "metadata": {
        "file_size": 603560,
        "content_type": "image/jpeg",
        "text_blocks_count": 1,
        "tables_count": 0,
        "figures_count": 0
      }
    },
    {
      "file_path": "facturas_probar_modelo\\factura_17.png",
      "filename": "factura_17.png",
      "success": true,
      "processing_time": 7.373147249221802,
      "extracted_fields": {
        "razon_social_vendedor": "Tech Consulting SRL",
        "cuit_vendedor": "30-99999999-7",
        "razon_social_comprador": "Susana Ruiz",
        "cuit_comprador": "20-12345678-9",
        "condicion_iva_comprador": "Monotributista",
        "condicion_venta": "Contado",
        "fecha_emision": "27/04/2025",
        "subtotal": "26.160,00",
        "importe_total": "34.043,60",
        "numero_factura": "37642520",
        "punto_venta": "0004",
        "tipo_factura": "A",
        "items": [
          {
            "codigo": "1",
            "descripcion": "Capacitación",
            "cantidad": "1",
            "unidad_medida": "unidad",
            "precio_unitario": "5.000,00",
            "importe_bonificacion": "350,00",
            "subtotal": "4.650,00"
          },
          {
            "codigo": "3",
            "descripcion": "Instalación servidores",
            "cantidad": "1",
            "unidad_medida": "unidad",
            "precio_unitario": "12.000,00",
            "importe_bonificacion": "240,00",
            "subtotal": "11.760,00"
          },
          {
            "codigo": "4",
            "descripcion": "Licencia software",
            "cantidad": "2",
            "unidad_medida": "unidad",
            "precio_unitario": "3.000,00",
            "importe_bonificacion": "480,00",
            "subtotal": "5.520,00"
          }
        ],
        "deuda_impositiva": "7.883,60"
      },
      "extracted_text": "ORIGINAL   Tech Consulting SRL Razón Social: Tech Consulting SRL Domicilio Comercial:San Juan 500 Condición frente al IVA: Responsable Inscripto A coD.001   FACTURA     Punto de Venta: 0004 Comp.Nro: 37642520 Fecha de Emisión: 27/04/2025 CUIT: 30-99999999-7 Ingresos Brutos: 25760980237 Fecha de Inicio de Actividades: 01/01/2020   Período Facturado Desde: 01/01/2025 Hasta: 31/12/2025 Fecha de Vto. para el pago: 30/04/2025         DNI: 20-12345678-9 Condición frente al IVA: Monotributista Condición de venta: Contado Apellido y Nombre / Razón Social: Susana Ruiz Domicilio: Avenida San Juan 850                                               [ Producto / servicio a Cantidad — |U. Medida] PrecioUnit —|%Bonif]__ imp. Boni. ‘Subtotal 1 Capacitación 1 unidad 5.000,00 7% 350,00 4.650,00 2 Mantenimiento mensual 3 unidad — 1.500,00 6% 270,00 4.230,00 3 Instalación de servidores 1 unidad 12.000,00 2% 240,00 11.760,00 4 Licencia software 2 unidad 3.000,00 8% 480,00 5.520,00 Percepción IIB: $ 1.500,00 IVA: Subtotal: $26.160,00 Importe Otros Tributos: $890,00 Importe Total: $34.043,60 Pág. 1/1 5165247793596 Fecha de Vto. de CAE: 01/05/2025 Comprobante Autorizado   Esta Agencia no se responsabllza poros datos Ingrezados an l dea de a operacion",
      "confidence_score": 0.06785714285714287,
      "metrics": null,
      "metadata": {
        "file_size": 603092,
        "content_type": "image/jpeg",
        "text_blocks_count": 1,
        "tables_count": 0,
        "figures_count": 0
      }
    },
    {
      "file_path": "facturas_probar_modelo\\factura_19.png",
      "filename": "factura_19.png",
      "success": true,
      "processing_time": 6.459012269973755,
      "extracted_fields": {
        "razon_social_vendedor": "IT Masters SRL",
        "cuit_vendedor": "30-99999999-7",
        "razon_social_comprador": "Masters SRL",
        "cuit_comprador": "20-12345678-9",
        "condicion_iva_comprador": "Monotributista",
        "condicion_venta": "Contado",
        "fecha_emision": "27/04/2025",
        "subtotal": "5.220,00",
        "importe_total": "8.502,20",
        "iva": "1.096,20",
        "numero_factura": "99666879",
        "punto_venta": "0004",
        "tipo_factura": "A",
        "items": [
          {
            "codigo": "1",
            "descripcion": "Licencia software",
            "cantidad": "2",
            "unidad_medida": "unidad",
            "precio_unitario": "3.000,00",
            "importe_bonificacion": "780,00",
            "subtotal": "5.220,00"
          }
        ],
        "deuda_impositiva": "3.282,20"
      },
      "extracted_text": "ORIGINAL   IT Masters SRL Razón Social: IT Masters SRL Domicilio Comercial:Calle Corrientes 1500 Condición frente al IVA: Responsable Inscripto 1/01/2025   Período Facturado Desde:   Hasta: 31/12/2025 Fecha de Vto. para el pago: 30/04/2025 A | FACTURA coD.001       Punto de Venta: 0004 Comp. Nro: 99666879 Fecha de Emisión: 27/04/2025 CUIT: 30-99999999-7 Ingresos Brutos: 22206926092 Fecha de Inicio de Actividades: 01/01/2020         Condición frente al IVA: Monotributista Condición de venta: Contado DNI: 20-12345678-9 Apellido y Nombre / Razón Social: Pedro Fernandez Domlcillo: Caballito 400                 [E cantidad   |U, Medida| — PrecioUnit —— — imp.Bonif ‘Subtotal             1 Licencia software 2 unidad 3.000,00 13% 780,00 5.220,00   Percepción IIBB: $ 1.500,00 IVA: $ 1.096,20 Subtotal: $5.220,00 Importe Otros Tributos: $686,00 Importe Total: $8.502,20           Comprobante Autorizado   5165247793596 Fecha de Vto. de CAE: 01/05/2025   Pág. 1/1 Esta Agencia no se responsabllza poros datos Ingrezados an l dea de a operacion",
      "confidence_score": 0.07333333333333333,
      "metrics": null,
      "metadata": {
        "file_size": 582638,
        "content_type": "image/jpeg",
        "text_blocks_count": 1,
        "tables_count": 0,
        "figures_count": 0
      }
    },
    {
      "file_path": "facturas_probar_modelo\\factura_18.png",
      "filename": "factura_18.png",
      "success": true,
      "processing_time": 7.243772506713867,
      "extracted_fields": {
        "razon_social_vendedor": "TechnoConsult SRL",
        "cuit_vendedor": "30-99999999-7",
        "razon_social_comprador": "TechnoConsult SRL",
        "cuit_comprador": "20-12345678-9",
        "condicion_iva_comprador": "Monotributista",
        "condicion_venta": "Contado",
        "fecha_emision": "27/04/2025",
        "subtotal": "33.340,00",
        "importe_total": "42.725,40",
        "iva": "7.001,40",
        "numero_factura": "66856535",
        "punto_venta": "0004",
        "tipo_factura": "A",
        "items": [
          {
            "codigo": "2",
            "descripcion": "Capacitación",
            "cantidad": "1",
            "unidad_medida": "unidad",
            "precio_unitario": "5.000,00",
            "importe_bonificacion": "900,00",
            "subtotal": "4.100,00"
          },
          {
            "codigo": "3",
            "descripcion": "Desarrollo software",
            "cantidad": "2",
            "unidad_medida": "unidad",
            "precio_unitario": "8.000,00",
            "importe_bonificacion": "1.760,00",
            "subtotal": "14.240,00"
          }
        ],
        "deuda_impositiva": "9.385,40"
      },
      "extracted_text": "ORIGINAL   TechnoConsult SRL Razón Social: TechnoConsult SRL Domicilio Comercial:Avenida Libertador 450 Condición frente al IVA: Responsable Inscripto   Período Facturado Desde: 01/01/2025   A coD.001 FACTURA Punto de Venta: 0004 Fecha de Emisión: 27/04/2025       CUIT: 30-99999999-7 Ingresos Brutos: 21213685885 Hasta: 31/12/2025 Comp. Nro: 66856535 Fecha de Inicio de Actividades: 01/01/2020 Fecha de Vto. para el pago: 30/04/2025         DNI: 20-12345678-9 Condición frente al IVA: Monotributista Condición de venta: Contado Apellido y Nombre / Razón Social: Javier Morales Domicitio: Calle Tucumán 700                                           [ Producto / servicio Ju. medida] Precioun [Bont] imp. Bont. Subtotal 1 Soporte técnico 5, unidad 2.000,00 10% 1.000,00 9.000,00 2 Capacitación 1 unidad 5.000,00 18% 900,00 4.100,00 3 Desarrollo de software 2 unidad 8.000,00 11% 1.760,00 14.240,00 4 Consultoría en IT. 1 unidad 7.500,00 20% 1.500,00 6.000,00 Percepción IIBB: $ 1.500,00 IVA: $7.001,40 Subtotal: $33.340,00 Importe Otros Tributos: $884,00 Importe Total: $42.725,40 Pág. 1/1 5165247793596   Comprobante Autorizado     Fecha de Vto. de CAE: 01/05/2025 Esta Agencia no se responsabllza poros datos Ingrezados an l dea de a operacion",
      "confidence_score": 0.07333333333333333,
      "metrics": null,
      "metadata": {
        "file_size": 601129,
        "content_type": "image/jpeg",
        "text_blocks_count": 1,
        "tables_count": 0,
        "figures_count": 0
      }
    },
    {
      "file_path": "facturas_probar_modelo\\factura_2.png",
      "filename": "factura_2.png",
      "success": true,
      "processing_time": 6.668014764785767,
      "extracted_fields": {
        "razon_social_vendedor": "HighTech Innovations SRL",
        "cuit_vendedor": "30-99999999-7",
        "razon_social_comprador": "Ricardo Herrera",
        "cuit_comprador": "20-12345678-9",
        "fecha_emision": "27/04/2025",
        "subtotal": "12.960,00",
        "importe_total": "17.891,60",
        "iva": "2.721,60",
        "numero_factura": "21696565",
        "punto_venta": "0004",
        "tipo_factura": "A",
        "items": [
          {
            "codigo": "1",
            "descripcion": "Análisis datos",
            "cantidad": "4",
            "unidad_medida": "unidad",
            "precio_unitario": "4.000,00",
            "importe_bonificacion": "3.040,00",
            "subtotal": "12.960,00"
          }
        ],
        "deuda_impositiva": "4.931,60"
      },
      "extracted_text": "ORIGINAL A : A RA HighTech Innovations SRL | eoo.001 FACTU Comp. Nro: 21696565 Punto de Venta: 0004 Fecha de Emisión: 27/04/2025         Razón Social: HighTech Innovations SRL CUIT: 30-99999999-7 Ingresos Brutos: 26791555947 Fecha de Inicio de Actividades: 01/01/2020 Domicilio Comercial:Avenida Rivadavia 1200 Condición frente al IVA: Responsable Inscripto 1/01/2025 Hasta: 31/12/2025 Fecha de Vto. para el pago: 30/04/2025     Período Facturado Desde: DNI: 20-12345678-9 Apellido y Nombre / Razón Social: Ricardo Herrera Domicilio: Calle Montevideo 1200         Condición frente al IVA: Responsable Inscripto Condicién de venta: Contado                               [ Producto / Servicio [cantidad — Ju. medida] Precio unit. [%Bonit] imp. Bont. ‘Subtotal 1 Análisis de datos 4 unidad 4.000,00 19% 3.040,00 12.960,00   Percepción IIBB: $ 1.500,00 IVA: $2.721,60 Subtotal: $12.960,00 Importe Otros Tributos: $710,00 Importe Total: $17.891,60         5165247793596 Fecha de Vto. de CAE: 01/05/2025   Pág. 1/1   Comprobante Autorizado Esta Agencia no se responsabllza poros datos Ingrezados an l dea de a operacion",
      "confidence_score": 0.08461538461538462,
      "metrics": null,
      "metadata": {
        "file_size": 584527,
        "content_type": "image/jpeg",
        "text_blocks_count": 1,
        "tables_count": 0,
        "figures_count": 0
      }
    },
    {
      "file_path": "facturas_probar_modelo\\factura_20.png",
      "filename": "factura_20.png",
      "success": true,
      "processing_time": 7.2942047119140625,
      "extracted_fields": {
        "razon_social_vendedor": "Commerce Solutions SA",
        "cuit_vendedor": "30-99999999-7",
        "razon_social_comprador": "Carlos Martinez",
        "cuit_comprador": "20-12345678-9",
        "condicion_iva_comprador": "Monotributista",
        "condicion_venta": "Contado",
        "fecha_emision": "27/04/2025",
        "subtotal": "28.450,00",
        "importe_total": "36.257,50",
        "iva": "5.974,50",
        "numero_factura": "89632519",
        "punto_venta": "0004",
        "tipo_factura": "A",
        "items": [
          {
            "codigo": "1",
            "descripcion": "Análisis datos",
            "cantidad": "4",
            "unidad_medida": "unidad",
            "precio_unitario": "4.000,00",
            "importe_bonificacion": "0,00",
            "subtotal": "16.000,00"
          },
          {
            "codigo": "2",
            "descripcion": "Implementación red",
            "cantidad": "3",
            "unidad_medida": "unidad",
            "precio_unitario": "5.000,00",
            "importe_bonificacion": "2.550,00",
            "subtotal": "12.450,00"
          }
        ],
        "deuda_impositiva": "7.807,50"
      },
      "extracted_text": "ORIGINAL E-Commerce Solutions SA Le PAGTURA         Punto de Venta: 0004 Comp.Nro: 89632519 Razón Social: E-Commerce Solutions SA Fecha de Emisión: 27/04/2025 CUIT: 30-99999999-7 Ingresos Brutos: 22603765413 Fecha de Inicio de Actividades: 01/01/2020 Domicilio Comercial:Calle Montevideo 1200 Condición frente al IVA: Responsable Inscripto             Período Facturado Desde: 01/01/2025 Hasta: 31/12/2025 Fecha de Vto. para el pago: 30/04/2025 DNI: 20-12345678-9 Apellido y Nombre / Razón Social: Carlos Martinez Condición frente al IVA: Monotributista Domicilio: Rivadavia 300 Condición de venta: Contado                               [ Producto / servicio — [u. — preciount [ont] imp. Bont. Subtotal 1 Análisis de datos 4 unidad 4.000,00 0% 0,00 16.000,00 2 Implementación de red 3 unidad 5.000,00 17% 2.550,00 12.450,00   Percepción IIBB: $ 1.500,00 IVA: $5.974,50 Subtotal: $28.450,00 Importe Otros Tributos: $333,00 Importe Total: $36.257,50         5165247793596 Fecha de Vto. de CAE: 01/05/2025   Pág. 1/1   Comprobante Autorizado Esta Agencia no se responsabllza poros datos Ingrezados an l dea de a operacion",
      "confidence_score": 0.07333333333333333,
      "metrics": null,
      "metadata": {
        "file_size": 588858,
        "content_type": "image/jpeg",
        "text_blocks_count": 1,
        "tables_count": 0,
        "figures_count": 0
      }
    },
    {
      "file_path": "facturas_probar_modelo\\factura_201.png",
      "filename": "factura_201.png",
      "success": true,
      "processing_time": 6.885067462921143,
      "extracted_fields": {
        "razon_social_vendedor": "Data Systems Ltda a",
        "cuit_vendedor": "30-99999999-7",
        "razon_social_comprador": "Javier Morales",
        "cuit_comprador": "20-12345678-9",
        "condicion_iva_comprador": "Exento",
        "condicion_venta": "Contado",
        "fecha_emision": "27/04/2025",
        "subtotal": "11.400,00",
        "importe_total": "11.400,00",
        "numero_factura": "79194157",
        "punto_venta": "0004",
        "tipo_factura": "A",
        "items": [
          {
            "codigo": "1",
            "descripcion": "Instalación servidores",
            "cantidad": "1",
            "unidad_medida": "unidad",
            "precio_unitario": "12.000,00",
            "importe_bonificacion": "600,00",
            "subtotal": "11.400,00"
          }
        ],
        "deuda_impositiva": "0,00"
      },
      "extracted_text": "ORIGINAL Data Systems Ltda a PAGTURA Razón Social: Data Systems Ltda         Punto de Venta: 0004 Comp. Nro: 79194157 Fecha de Emisión: 27/04/2025 CUIT: 30-99999999-7 Ingresos Brutos: 26640814742 Fecha de Inicio de Actividades: 01/01/2020 Domicilio Comercial:Av. Caseros 600 Condición frente al IVA: Responsable Inscripto             Período Facturado Desde: 01/01/2025 Hasta: 31/12/2025 Fecha de Vto. para el pago: 30/04/2025 DNI: 20-12345678-9 Apellido y Nombre / Razón Social: Javier Morales Condición frente al IVA: Exento Domicilio: Rivadavia 300 Condición de venta: Contado                               [ Producto / servicio | cantidad — Ju. medida] Precio unit. [Bon] — Bont. Subtotal 1 Instalación de servidores 1 unidad 12.000,00 5% 600,00 11.400,00   Subtotal: $11.400,00 Importe Otros Tributos: $0,00 Importe Total: $11.400,00           5165247793596 Fecha de Vto. de CAE: 01/05/2025 Pag. 1/1   Comprobante Autorizado Esta Agencia no se responsabllza poros datos Ingresados an l dea de a operacion",
      "confidence_score": 0.06785714285714287,
      "metrics": null,
      "metadata": {
        "file_size": 574431,
        "content_type": "image/jpeg",
        "text_blocks_count": 1,
        "tables_count": 0,
        "figures_count": 0
      }
    },
    {
      "file_path": "facturas_probar_modelo\\factura_203.png",
      "filename": "factura_203.png",
      "success": true,
      "processing_time": 6.930356025695801,
      "extracted_fields": {
        "razon_social_vendedor": "B Soluciones Innovadoras SA",
        "cuit_vendedor": "30-99999999-7",
        "razon_social_comprador": "Pedro Fernandez",
        "cuit_comprador": "20-12345678-9",
        "condicion_venta": "Contado",
        "fecha_emision": "27/04/2025",
        "subtotal": "16.320,00",
        "importe_total": "16.320,00",
        "numero_factura": "99999999",
        "punto_venta": "0004",
        "tipo_factura": "A",
        "items": [
          {
            "codigo": "1",
            "descripcion": "Licencia software",
            "cantidad": "2",
            "unidad_medida": "unidad",
            "precio_unitario": "3.000,00",
            "importe_bonificacion": "960,00",
            "subtotal": "5.040,00"
          },
          {
            "codigo": "2",
            "descripcion": "Instalación servidores",
            "cantidad": "1",
            "unidad_medida": "unidad",
            "precio_unitario": "12.000,00",
            "importe_bonificacion": "720,00",
            "subtotal": "11.280,00"
          }
        ],
        "deuda_impositiva": "0,00"
      },
      "extracted_text": "ORIGINAL . B Soluciones Innovadoras SA coo.00s PAGTURA     Punto de Venta: 0004 Razón Social: Soluciones Innovadoras SA Fecha de Emisión: 27/04/2025 CUIT: 30-99999999-7 Ingresos Brutos: 27905155026 Fecha de Inicio de Actividades: 01/01/2020 Domicilio Comercial:San Telmo 250 Condición frente al IVA: Responsable Inscripto 1/01/2025 Hasta: 31/12/2025 Fecha de Vto. para el pago: 30/04/2025     Período Facturado Desde:         DNI: 20-12345678-9 Apellido y Nombre / Razón Social: Pedro Fernandez Condición frente al (VA: Consumidor Final Domicilio: Maipú 200 Condición de venta: Contado                               [ Producto / servicio Ju. medida] recioun [Bont] imp. Bont. Subtotal 1 Licencia software 2 unidad 3.000,00 16% 960,00 5.040,00 2 Instalación de servidores 1 unidad 12.000,00 6% 720,00 11.280,00   Subtotal: $16.320,00 Importe Otros Tributos: $0,00 Importe Total: $16.320,00           5165247793596 Fecha de Vto. de CAE: 01/05/2025 Pag. 1/1   Comprobante Autorizado Esta Agencia no se responsabllza poros datos Ingresados an l dea de a operacion",
      "confidence_score": 0.07307692307692308,
      "metrics": null,
      "metadata": {
        "file_size": 582184,
        "content_type": "image/jpeg",
        "text_blocks_count": 1,
        "tables_count": 0,
        "figures_count": 0
      }
    },
    {
      "file_path": "facturas_probar_modelo\\factura_202.png",
      "filename": "factura_202.png",
      "success": true,
      "processing_time": 7.517892599105835,
      "extracted_fields": {
        "razon_social_vendedor": "Sys Tech SA",
        "cuit_vendedor": "30-99999999-7",
        "razon_social_comprador": "Elena Jiménez",
        "cuit_comprador": "20-12345678-9",
        "condicion_iva_comprador": "Responsable Inscripto",
        "condicion_venta": "Contado",
        "fecha_emision": "27/04/2025",
        "subtotal": "51.880,00",
        "importe_total": "51.880,00",
        "numero_factura": "37629666",
        "punto_venta": "0004",
        "tipo_factura": "A",
        "items": [
          {
            "codigo": "1",
            "descripcion": "Análisis datos",
            "cantidad": "4",
            "unidad_medida": "unidad",
            "precio_unitario": "4.000,00",
            "importe_bonificacion": "1.920,00",
            "subtotal": "14.080,00"
          },
          {
            "codigo": "2",
            "descripcion": "Instalación servidores",
            "cantidad": "1",
            "unidad_medida": "unidad",
            "precio_unitario": "12.000,00",
            "importe_bonificacion": "360,00",
            "subtotal": "11.640,00"
          },
          {
            "codigo": "3",
            "descripcion": "Desarrollo software",
            "cantidad": "2",
            "unidad_medida": "unidad",
            "precio_unitario": "8.000,00",
            "importe_bonificacion": "3.040,00",
            "subtotal": "12.960,00"
          }
        ],
        "deuda_impositiva": "0,00"
      },
      "extracted_text": "ORIGINAL                     SysTech SA 00,006 Punto de Venta: 0004 Comp. Nro: 37629666 Razón Social: Sys Tech SA Fecha de Emisión: 27/04/2025 Domicilio Comercial:Rivadavia 1300 CUIT: 30-99999999-7 Ingresos Brutos: 24596754695 Condición frente al IVA: Responsable Inscripto Fecha de Inicio de Actividades: 01/01/2020 Período Facturado Desde: 01/01/2025 Hasta: 31/12/2025 Fecha de Vto. para el pago: 30/04/2025 DNI: 20-12345678-9 Apellido y Nombre / Razón Social: Elena Jiménez Condición frente al IVA: Consumidor Final Domicilio: Palermo 350 Condición de venta: Contado                               [ Producto / servicio Ju. medida] recioun [Bont] imp. Bont. Subtotal 1 Análisis de datos 4 unidad 4.000,00 12% 1.920,00 14.080,00 2 Instalación de servidores 1 unidad 12.000,00 3% 360,00 11.640,00 3 Desarrollo de software 2 unidad 8.000,00 19% 3.040,00 12.960,00 4 Implementación de red E unidad 5.000,00 12% 1.800,00 13.200,00   Subtotal: $51.880,00 Importe Otros Tributos: $0,00 Importe Total: $51.880,00             5165247793596 Fecha de Vto. de CAE: 01/05/2025 Pag. 1/1   Comprobante Autorizado Esta Agencia no se responsabllza poros datos Ingresados an l dea de a operacion",
      "confidence_score": 0.06785714285714287,
      "metrics": null,
      "metadata": {
        "file_size": 590336,
        "content_type": "image/jpeg",
        "text_blocks_count": 1,
        "tables_count": 0,
        "figures_count": 0
      }
    },
    {
      "file_path": "facturas_probar_modelo\\factura_204.png",
      "filename": "factura_204.png",
      "success": true,
      "processing_time": 6.828678846359253,
      "extracted_fields": {
        "cuit_vendedor": "30-99999999-7",
        "razon_social_comprador": "Javier Morales",
        "cuit_comprador": "20-12345678-9",
        "condicion_iva_comprador": "Exento",
        "condicion_venta": "Contado",
        "fecha_emision": "27/04/2025",
        "subtotal": "8.300,00",
        "importe_total": "8.300,00",
        "numero_factura": "41237254",
        "punto_venta": "0004",
        "tipo_factura": "A",
        "items": [
          {
            "codigo": "1",
            "descripcion": "Soporte técnico",
            "cantidad": "5",
            "unidad_medida": "unidad",
            "precio_unitario": "2.000,00",
            "importe_bonificacion": "1.700,00",
            "subtotal": "8.300,00"
          }
        ],
        "deuda_impositiva": "0,00"
      },
      "extracted_text": "ORIGINAL Digital Experts SRL cotas] FACTURA Razón Social: Digital Experts SRL         Punto de Venta: 0004 Comp.Nro: 41237254 Fecha de Emisión: 27/04/2025 CUIT: 30-99999999-7 Ingresos Brutos: 23146183210 Fecha de Inicio de Actividades: 01/01/2020 Domicilio Comercial:San Juan 500 Condición frente al IVA: Responsable Inscripto             Período Facturado Desde: 01/01/2025 Hasta: 31/12/2025 Fecha de Vto. para el pago: 30/04/2025 DNI: 20-12345678-9 Apellido y Nombre / Razón Social: Javier Morales Condición frente al IVA: Exento Domicilio: Av. La Plata 800 Condición de venta: Contado                               [ Producto / servicio | cantidad — Ju. medida] Precio unit. [Bon] — Bont. Subtotal 1 Soporte técnico 5 unidad 2.000,00 17% 1.700,00 8.300,00   Subtotal: $8.300,00 Importe Otros Tributos: $0,00 Importe Total: $8.300,00           Pág. 1/1 5165247793596 ARCA Fecha de Vto. de CAE: 01/05/2025   Comprobante Autorizado Esta Agencia no se responsabllza poros datos Ingresados an l dea de a operacion",
      "confidence_score": 0.07307692307692308,
      "metrics": null,
      "metadata": {
        "file_size": 575308,
        "content_type": "image/jpeg",
        "text_blocks_count": 1,
        "tables_count": 0,
        "figures_count": 0
      }
    },
    {
      "file_path": "facturas_probar_modelo\\factura_206.png",
      "filename": "factura_206.png",
      "success": true,
      "processing_time": 6.845276355743408,
      "extracted_fields": {
        "razon_social_vendedor": "Network Solutions SA a",
        "cuit_vendedor": "30-99999999-7",
        "razon_social_comprador": "Ricardo Herrera",
        "cuit_comprador": "20-12345678-9",
        "condicion_iva_comprador": "Consumidor Final",
        "condicion_venta": "Contado",
        "fecha_emision": "27/04/2025",
        "subtotal": "4.450,00",
        "importe_total": "4.450,00",
        "numero_factura": "37571637",
        "punto_venta": "0004",
        "tipo_factura": "A",
        "items": [
          {
            "codigo": "1",
            "descripcion": "Capacitación",
            "cantidad": "1",
            "unidad_medida": "unidad",
            "precio_unitario": "5.000,00",
            "importe_bonificacion": "550,00",
            "subtotal": "4.450,00"
          }
        ],
        "deuda_impositiva": "0,00"
      },
      "extracted_text": "ORIGINAL Network Solutions SA a PAGTURA Razón Social: Network Solutions SA         Punto de Venta: 0004 Comp.Nro: 37571637 Fecha de Emisión: 27/04/2025 CUIT: 30-99999999-7 Ingresos Brutos: 24476243550 Fecha de Inicio de Actividades: 01/01/2020 Domicilio Comercial:Calle Viamonte 800 Condición frente al IVA: Responsable Inscripto             Período Facturado Desde: 01/01/2025 Hasta: 31/12/2025 Fecha de Vto. para el pago: 30/04/2025 DNI: 20-12345678-9 Apellido y Nombre / Razón Social: Ricardo Herrera Condición frente al IVA: Consumidor Final Domicilio: Calle Viamonte 800 Condición de venta: Contado                               [ Producto / servicio | cantidad — Ju. medida] Precio unit. [Bon] — Bont. Subtotal 1 Capacitación 1 unidad 5.000,00 11% 550,00 4.450,00   Subtotal: $4.450,00 Importe Otros Tributos: $0,00 Importe Total: $4.450,00           Pág. 1/1 5165247793596 ARCA Fecha de Vto. de CAE: 01/05/2025   Comprobante Autorizado Esta Agencia no se responsabllza poros datos Ingresados an l dea de a operacion",
      "confidence_score": 0.06785714285714287,
      "metrics": null,
      "metadata": {
        "file_size": 575066,
        "content_type": "image/jpeg",
        "text_blocks_count": 1,
        "tables_count": 0,
        "figures_count": 0
      }
    },
    {
      "file_path": "facturas_probar_modelo\\factura_205.png",
      "filename": "factura_205.png",
      "success": true,
      "processing_time": 7.466714859008789,
      "extracted_fields": {
        "razon_social_vendedor": "NextGen Solutions SA",
        "cuit_vendedor": "30-99999999-7",
        "razon_social_comprador": "Solutions SA",
        "cuit_comprador": "20-12345678-9",
        "condicion_iva_comprador": "Exento",
        "condicion_venta": "Contado",
        "fecha_emision": "27/04/2025",
        "subtotal": "22.790,00",
        "importe_total": "22.790,00",
        "numero_factura": "97903305",
        "punto_venta": "0004",
        "tipo_factura": "A",
        "items": [
          {
            "codigo": "1",
            "descripcion": "Mantenimiento mensual",
            "cantidad": "3",
            "unidad_medida": "unidad",
            "precio_unitario": "1.500,00",
            "importe_bonificacion": "630,00",
            "subtotal": "3.870,00"
          },
          {
            "codigo": "3",
            "descripcion": "Análisis datos",
            "cantidad": "4",
            "unidad_medida": "unidad",
            "precio_unitario": "4.000,00",
            "importe_bonificacion": "2.240,00",
            "subtotal": "13.760,00"
          }
        ],
        "deuda_impositiva": "0,00"
      },
      "extracted_text": "ORIGINAL   NextGen Solutions SA Razón Social: NextGen Solutions SA Domicilio Comercial:Calle Tucumán 700 Condición frente al IVA: Responsable Inscripto Período Facturado Desde:   11/01/2025 B coD,006       Hasta: 31/12/2025 FACTURA Punto de Venta: 0004 Comp.Nro: 97903305 Fecha de Emisión: 27/04/2025 CUIT: 30-99999999-7 Ingresos Brutos: 26697037278 Fecha de Inicio de Actividades: 01/01/2020   Fecha de Vto. para el pago: 30/04/2025         Condición frente al IVA: Exento Condición de venta: Contado DNI: 20-12345678-9 Apellido y Nombre / Razón Social: Luis Ramirez Domicitio: Avenida Rivadavia 1200                                           [ Producto / servicio Ju. medida] recioun [Bont] imp. Bont. Subtotal 1 Mantenimiento mensual 3 unidad 1.500,00 14% 630,00 3.870,00 2 Licencia software unidad 3.000,00 14% 840,00 5.160,00 3 Análisis de datos 4 unidad 4.000,00 14% 2.240,00 13.760,00 Subtotal: $22.790,00 Importe Otros Tributos: $0,00 Importe Total: $22.790,00 Pág. 1/1 5165247793596   Comprobante Autorizado     Fecha de Vto. de CAE: 01/05/2025 Esta Agencia no se responsabllza poros datos Ingresados an l dea de a operacion",
      "confidence_score": 0.06785714285714287,
      "metrics": null,
      "metadata": {
        "file_size": 586313,
        "content_type": "image/jpeg",
        "text_blocks_count": 1,
        "tables_count": 0,
        "figures_count": 0
      }
    },
    {
      "file_path": "facturas_probar_modelo\\factura_207.png",
      "filename": "factura_207.png",
      "success": true,
      "processing_time": 6.827826738357544,
      "extracted_fields": {
        "cuit_vendedor": "30-99999999-7",
        "razon_social_comprador": "Alba Pérez",
        "cuit_comprador": "20-12345678-9",
        "condicion_iva_comprador": "Consumidor Final",
        "condicion_venta": "Contado",
        "fecha_emision": "27/04/2025",
        "subtotal": "8.860,00",
        "importe_total": "8.860,00",
        "numero_factura": "21065436",
        "punto_venta": "0004",
        "tipo_factura": "A",
        "items": [
          {
            "codigo": "1",
            "descripcion": "Capacitación",
            "cantidad": "1",
            "unidad_medida": "unidad",
            "precio_unitario": "5.000,00",
            "importe_bonificacion": "1.000,00",
            "subtotal": "4.000,00"
          },
          {
            "codigo": "2",
            "descripcion": "Licencia software",
            "cantidad": "2",
            "unidad_medida": "unidad",
            "precio_unitario": "3.000,00",
            "importe_bonificacion": "1.140,00",
            "subtotal": "4.860,00"
          }
        ],
        "deuda_impositiva": "0,00"
      },
      "extracted_text": "ORIGINAL Global Networks SRL cathe} FACTURA Razón Social: Global Networks SRL         Punto de Venta: 0004 Comp.Nro: 21065436 Fecha de Emisión: 27/04/2025 CUIT: 30-99999999-7 Ingresos Brutos: 28157398967 Fecha de Inicio de Actividades: 01/01/2020 Domicilio Comercial:Rivadavia 1300 Condición frente al IVA: Responsable Inscripto             Período Facturado Desde: 01/01/2025 Hasta: 31/12/2025 Fecha de Vto. para el pago: 30/04/2025 DNI: 20-12345678-9 Apellido y Nombre / Razón Social: Alba Pérez Condición frente al IVA: Consumidor Final Domicilio: Calle Viamonte 800 Condición de venta: Contado                               [ Producto / servicio Ju. medida] recioun [Bont] imp. Bont. Subtotal 1 Capacitación 1 unidad 5.000,00 20% 1.000,00 4.000,00 2 Licencia software 2 unidad 3.000,00 19% 1.140,00 4.860,00   Subtotal: $8.860,00 Importe Otros Tributos: $0,00 Importe Total: $8.860,00           5165247793596 Fecha de Vto. de CAE: 01/05/2025 Pag. 1/1   Comprobante Autorizado Esta Agencia no se responsabllza poros datos Ingresados an l dea de a operacion",
      "confidence_score": 0.07307692307692308,
      "metrics": null,
      "metadata": {
        "file_size": 581939,
        "content_type": "image/jpeg",
        "text_blocks_count": 1,
        "tables_count": 0,
        "figures_count": 0
      }
    },
    {
      "file_path": "facturas_probar_modelo\\factura_208.png",
      "filename": "factura_208.png",
      "success": true,
      "processing_time": 6.837412595748901,
      "extracted_fields": {
        "razon_social_vendedor": "Consultora IT SRL",
        "cuit_vendedor": "30-99999999-7",
        "razon_social_comprador": "Lucia Martinez",
        "cuit_comprador": "20-12345678-9",
        "condicion_iva_comprador": "Exento",
        "condicion_venta": "Contado",
        "fecha_emision": "27/04/2025",
        "subtotal": "16.645,00",
        "importe_total": "16.645,00",
        "numero_factura": "63484671",
        "punto_venta": "0004",
        "tipo_factura": "A",
        "items": [
          {
            "codigo": "1",
            "descripcion": "Licencia software",
            "cantidad": "2",
            "unidad_medida": "unidad",
            "precio_unitario": "3.000,00",
            "importe_bonificacion": "480,00",
            "subtotal": "5.520,00"
          },
          {
            "codigo": "3",
            "descripcion": "Capacitación",
            "cantidad": "1",
            "unidad_medida": "unidad",
            "precio_unitario": "5.000,00",
            "importe_bonificacion": "250,00",
            "subtotal": "4.750,00"
          }
        ],
        "deuda_impositiva": "0,00"
      },
      "extracted_text": "ORIGINAL   Consultora IT SRL Razón Social: Consultora IT SRL Domicilio Comercial:Palermo 350 Condición frente al IVA: Responsable Inscripto coD,006       B | FACTURA Punto de Venta: 0004 Fecha de Emisión: 27/04/2025 CUIT: 30-99999999-7 Ingresos Brutos: 27201052095 Fecha de Inicio de Actividades: 01/01/2020 Comp. Nro: 63484671   Período Facturado Desde:   11/01/2025 Hasta: 31/12/2025 Fecha de Vto. para el pago: 30/04/2025         DNI: 20-12345678-9 Apellido y Nombre / Razón Social: Lucia Martinez Condición frente al IVA: Exento Condición de venta: Contado Domicilio: Av. Santa Fe 1100                                               [ Producto / servicio — [u. — preciount [ont] imp. Bont. Sublotal 1 Licencia software 2 unidad 3.000,00 8% 480,00 5.520,00 2 Consultoría en IT. 1 unidad 7.500,00 15% 1.125,00 6.375,00 3 Capacitación 1 unidad 5.000,00 5% 250,00 4.750,00 Subtotal: $16.645,00 Importe Otros Tributos: $0,00 Importe Total: $16.645,00 ARCA Pág. 1/1 5165247793596 o Fecha de Vto. de CAE: 01/05/2025 Comprobante Autorizado   Esta Agencia no se responsabllza poros datos Ingresados an l dea de a operacion",
      "confidence_score": 0.06785714285714287,
      "metrics": null,
      "metadata": {
        "file_size": 583866,
        "content_type": "image/jpeg",
        "text_blocks_count": 1,
        "tables_count": 0,
        "figures_count": 0
      }
    },
    {
      "file_path": "facturas_probar_modelo\\factura_209.png",
      "filename": "factura_209.png",
      "success": true,
      "processing_time": 6.8027424812316895,
      "extracted_fields": {
        "razon_social_vendedor": "dvanced Systems SRL a",
        "cuit_vendedor": "30-99999999-7",
        "razon_social_comprador": "Patricia Lopez",
        "cuit_comprador": "20-12345678-9",
        "condicion_iva_comprador": "Consumidor Final",
        "condicion_venta": "Contado",
        "fecha_emision": "27/04/2025",
        "subtotal": "9.300,00",
        "importe_total": "9.300,00",
        "numero_factura": "36987028",
        "punto_venta": "0004",
        "tipo_factura": "A",
        "items": [
          {
            "codigo": "1",
            "descripcion": "Servicio consultoría",
            "cantidad": "1",
            "unidad_medida": "unidad",
            "precio_unitario": "10.000,00",
            "importe_bonificacion": "700,00",
            "subtotal": "9.300,00"
          }
        ],
        "deuda_impositiva": "0,00"
      },
      "extracted_text": "ORIGINAL Advanced Systems SRL a PAGTURA         Punto de Venta: 0004 Comp.Nro: 36987028 Razón Social: Advanced Systems SRL Fecha de Emisión: 27/04/2025 CUIT: 30-99999999-7 Ingresos Brutos: 20225365585 Fecha de Inicio de Actividades: 01/01/2020 Domicilio Comercial:Figueroa Alcorta 750 Condición frente al IVA: Responsable Inscripto             Período Facturado Desde: 01/01/2025 Hasta: 31/12/2025 Fecha de Vto. para el pago: 30/04/2025 DNI: 20-12345678-9 Apellido y Nombre / Razón Social: Patricia Lopez Condición frente al IVA: Consumidor Final Domicilio: Calle Viamonte 800 Condición de venta: Contado                               [ Producto / servicio | cantidad — Ju. medida] Precio unit. [Bon] — Bont. Subtotal 1 Servicio de consultoría 1 unidad 10.000,00 7% 700,00 9.300,00   Subtotal: $9.300,00 Importe Otros Tributos: $0,00 Importe Total: $9.300,00           5165247793596 Fecha de Vto. de CAE: 01/05/2025 Pag. 1/1   Comprobante Autorizado Esta Agencia no se responsabllza poros datos Ingresados an l dea de a operacion",
      "confidence_score": 0.06785714285714287,
      "metrics": null,
      "metadata": {
        "file_size": 577793,
        "content_type": "image/jpeg",
        "text_blocks_count": 1,
        "tables_count": 0,
        "figures_count": 0
      }
    },
    {
      "file_path": "facturas_probar_modelo\\factura_210.png",
      "filename": "factura_210.png",
      "success": true,
      "processing_time": 6.623800754547119,
      "extracted_fields": {
        "razon_social_vendedor": "Software Development SR a",
        "cuit_vendedor": "30-99999999-7",
        "razon_social_comprador": "Marcela Pérez",
        "cuit_comprador": "20-12345678-9",
        "condicion_iva_comprador": "Exento",
        "condicion_venta": "Contado",
        "fecha_emision": "27/04/2025",
        "subtotal": "13.280,00",
        "importe_total": "13.280,00",
        "numero_factura": "68420605",
        "punto_venta": "0004",
        "tipo_factura": "A",
        "items": [
          {
            "codigo": "1",
            "descripcion": "Análisis datos",
            "cantidad": "4",
            "unidad_medida": "unidad",
            "precio_unitario": "4.000,00",
            "importe_bonificacion": "2.72000",
            "subtotal": "13.280,00"
          }
        ],
        "deuda_impositiva": "0,00"
      },
      "extracted_text": "ORIGINAL Software Development SR a PAGTURA     Punto de Venta: 0004 Comp.Nro: 68420605 Razón Social: Software Development SRL Fecha de Emisión: 27/04/2025 CUIT: 30-99999999-7 Ingresos Brutos: 28904103289 Fecha de Inicio de Actividades: 01/01/2020 Domicilio Comercial:Calle Entre Rios 400 Condición frente al IVA: Responsable Inscripto             Período Facturado Desde: 01/01/2025 Hasta: 31/12/2025 Fecha de Vto. para el pago: 30/04/2025 DNI: 20-12345678-9 Apellido y Nombre / Razón Social: Marcela Pérez Condición frente al IVA: Exento Domicilio: Rivadavia 300 Condición de venta: Contado                               [ Producto / servicio | cantidad — Ju. medida] Precio unit. [Bon] — Bont. Subtotal 1 Análisis de datos 4 unidad 4.000,00 17%  2.72000 13.280,00   Subtotal: $13.280,00 Importe Otros Tributos: $0,00 Importe Total: $13.280,00           5165247793596 Fecha de Vto. de CAE: 01/05/2025 Pag. 1/1   Comprobante Autorizado Esta Agencia no se responsabllza poros datos Ingresados an l dea de a operacion",
      "confidence_score": 0.06785714285714287,
      "metrics": null,
      "metadata": {
        "file_size": 577555,
        "content_type": "image/jpeg",
        "text_blocks_count": 1,
        "tables_count": 0,
        "figures_count": 0
      }
    },
    {
      "file_path": "facturas_probar_modelo\\factura_211.png",
      "filename": "factura_211.png",
      "success": true,
      "processing_time": 6.601643800735474,
      "extracted_fields": {
        "razon_social_vendedor": "Redes y Servicios SA a",
        "cuit_vendedor": "30-99999999-7",
        "razon_social_comprador": "Marta Rodriguez",
        "cuit_comprador": "20-12345678-9",
        "condicion_iva_comprador": "Consumidor Final",
        "condicion_venta": "Contado",
        "fecha_emision": "27/04/2025",
        "subtotal": "8.200,00",
        "importe_total": "8.200,00",
        "numero_factura": "46794936",
        "punto_venta": "0004",
        "tipo_factura": "A",
        "items": [
          {
            "codigo": "1",
            "descripcion": "Servicio consultoría",
            "cantidad": "1",
            "unidad_medida": "unidad",
            "precio_unitario": "10.000,00",
            "importe_bonificacion": "1.800,00",
            "subtotal": "8.200,00"
          }
        ],
        "deuda_impositiva": "0,00"
      },
      "extracted_text": "ORIGINAL Redes y Servicios SA a PAGTURA         Punto de Venta: 0004 Comp.Nro: 46794936 Razón Social: Redes y Servicios SA Fecha de Emisión: 27/04/2025 CUIT: 30-99999999-7 Ingresos Brutos: 25485344433 Fecha de Inicio de Actividades: 01/01/2020 Domicilio Comercial:Corrientes 850 Condición frente al IVA: Responsable Inscripto             Período Facturado Desde: 01/01/2025 Hasta: 31/12/2025 Fecha de Vto. para el pago: 30/04/2025 DNI: 20-12345678-9 Apellido y Nombre / Razón Social: Marta Rodriguez Condición frente al IVA: Consumidor Final Domicilio: Calle Tucumán 700 Condición de venta: Contado                               [ Producto / servicio | cantidad — Ju. medida] Precio unit. [Bon] — Bont. Subtotal 1 Servicio de consultoría 1 unidad 10.000,00 18% 1.800,00 8.200,00   Subtotal: $8.200,00 Importe Otros Tributos: $0,00 Importe Total: $8.200,00           5165247793596 Fecha de Vto. de CAE: 01/05/2025 Pag. 1/1   Comprobante Autorizado Esta Agencia no se responsabllza poros datos Ingresados an l dea de a operacion",
      "confidence_score": 0.06785714285714287,
      "metrics": null,
      "metadata": {
        "file_size": 576511,
        "content_type": "image/jpeg",
        "text_blocks_count": 1,
        "tables_count": 0,
        "figures_count": 0
      }
    },
    {
      "file_path": "facturas_probar_modelo\\factura_212.png",
      "filename": "factura_212.png",
      "success": true,
      "processing_time": 6.412543535232544,
      "extracted_fields": {
        "razon_social_vendedor": "Quantum Technologies Ltda",
        "cuit_vendedor": "30-99999999-7",
        "razon_social_comprador": "Elena Jiménez",
        "cuit_comprador": "20-12345678-9",
        "condicion_iva_comprador": "Responsable Inscripto",
        "condicion_venta": "Contado",
        "fecha_emision": "27/04/2025",
        "subtotal": "42.420,00",
        "importe_total": "42.420,00",
        "numero_factura": "21290939",
        "punto_venta": "0004",
        "tipo_factura": "A",
        "items": [
          {
            "codigo": "1",
            "descripcion": "Mantenimiento mensual",
            "cantidad": "3",
            "unidad_medida": "unidad",
            "precio_unitario": "1.500,00",
            "importe_bonificacion": "360,00",
            "subtotal": "4.140,00"
          },
          {
            "codigo": "2",
            "descripcion": "Instalación servidores",
            "cantidad": "1",
            "unidad_medida": "unidad",
            "precio_unitario": "12.000,00",
            "importe_bonificacion": "1.200,00",
            "subtotal": "10.800,00"
          },
          {
            "codigo": "3",
            "descripcion": "Análisis datos",
            "cantidad": "4",
            "unidad_medida": "unidad",
            "precio_unitario": "4.000,00",
            "importe_bonificacion": "1.120,00",
            "subtotal": "14.880,00"
          },
          {
            "codigo": "4",
            "descripcion": "Implementación red",
            "cantidad": "3",
            "unidad_medida": "unidad",
            "precio_unitario": "5.000,00",
            "importe_bonificacion": "2400.00",
            "subtotal": "12600,00"
          }
        ],
        "deuda_impositiva": "0,00"
      },
      "extracted_text": "ORIGINAL Quantum Technologies Ltd wee FACTURA:     Punto de Venta: 0004 Comp.Nro: 21290939           Razón Social: Quantum Technologies Ltda Fecha de Emisión: 27/04/2025 Domicilio Comercial:Cabildo 1000 CUIT: 30-99999999-7 Ingresos Brutos: 21990381955 Condición frente al IVA: Responsable Inscripto Fecha de Inicio de Actividades: 01/01/2020 Período Facturado Desde: 01/01/2025 Hasta: 31/12/2025 Fecha de Vto. para el pago: 30/04/2025 DNI: 20-12345678-9 Apellido y Nombre / Razón Social: Elena Jiménez Condición frente al IVA: Exento Domicilio: San Telmo 250 Condición de venta: Contado                               | Producto / Servicio = “Cantidad — PrecioUntt —— [%Boni| — Imp.Bonif. ‘Subtotal 1 Mantenimiento mensual 3 unidad 1.500,00 8% 360,00 4.140,00 2 Instalación de servidores 1 unidad 12.000,00 10% 1.200,00 10.800,00 3 Análisis de datos 4 unidad 4.000,00 7% 1.120,00 14.880,00 4 Implementación de red 3 unidad 5.000,00 16% 2400.00 12600,00   Subtotal: $42.420,00 Importe Otros Tributos: $0,00 Importe Total: $42.420,00             5165247793596 Fecha de Vto. de CAE: 01/05/2025 Pag. 1/1   Comprobante Autorizado Esta Agencia no se responsabllza poros datos Ingresados an l dea de a operacion",
      "confidence_score": 0.06785714285714287,
      "metrics": null,
      "metadata": {
        "file_size": 592224,
        "content_type": "image/jpeg",
        "text_blocks_count": 1,
        "tables_count": 0,
        "figures_count": 0
      }
    }
  ]
}