{
  "batch_info": {
    "total_files": 15,
    "successful_files": 15,
    "failed_files": 0,
    "total_processing_time": 29.1408052444458,
    "timestamp": "2025-09-21 17:05:34"
  },
  "performance_metrics": {
    "throughput": 0.5147421244599608,
    "avg_processing_time": 7.346281560262044,
    "avg_confidence_score": 0.7962573099415204,
    "success_rate": 1.0,
    "total_documents_processed": 15,
    "total_processing_time": 29.1408052444458,
    "accuracy_metrics": {
      "avg_field_accuracy": 0.6762335703512173,
      "avg_cer": 0.6971357371136655,
      "avg_wer": 0.9262299064892505,
      "total_correct_fields": 148,
      "total_missing_fields": 32,
      "total_incorrect_fields": 17,
      "total_fields": 227
    }
  },
  "individual_results": [
    {
      "file_path": "C:\\Users\\selel\\OneDrive\\Documentos\\Facultad\\ARPYME\\creacion_dataset\\dataset_facturas\\factura_12.png",
      "filename": "factura_12.png",
      "success": true,
      "processing_time": 8.223781108856201,
      "extracted_fields": {
        "razon_social_vendedor": "Desarrollos Web SA a",
        "cuit_vendedor": "30-99999999-7",
        "razon_social_comprador": "Francisco Diaz",
        "cuit_comprador": "20-12345678-9",
        "fecha_emision": "27/04/2025",
        "subtotal": "17.770,00",
        "importe_total": "23.444,70",
        "iva": "3.731,70",
        "numero_factura": "61719278",
        "punto_venta": "0004",
        "tipo_factura": "A",
        "items": [
          {
            "codigo": "1",
            "descripcion": "Licencia software",
            "cantidad": "2",
            "unidad_medida": "unidad",
            "precio_unitario": "3.000,00",
            "bonificacion": "5%",
            "importe_bonificacion": "300,00",
            "subtotal": "5.700,00"
          },
          {
            "codigo": "2",
            "descripcion": "Mantenimiento mensual",
            "cantidad": "3",
            "unidad_medida": "unidad",
            "precio_unitario": "1.500,00",
            "bonificacion": "14%",
            "importe_bonificacion": "630,00",
            "subtotal": "3.870,00"
          },
          {
            "codigo": "3",
            "descripcion": "Soporte técnico",
            "cantidad": "5",
            "unidad_medida": "unidad",
            "precio_unitario": "2.000,00",
            "bonificacion": "18%",
            "importe_bonificacion": "1.800,00",
            "subtotal": "8.200,00"
          }
        ],
        "deuda_impositiva": "5.674,70"
      },
      "extracted_text": "ORIGINAL Desarrollos Web SA a PAGTURA Razón Social: Desarrollos Web SA         Punto de Venta: 0004 Comp.Nro: 61719278 Fecha de Emisión: 27/04/2025            CUIT: 30-99999999-7 Ingresos Brutos: Fecha de Inicio de Actividades: Domicilio Comercial:     Condición frente al IVA:         Período Facturado Desde: Hasta: Fecha de Vto. para el pago: DNI: 20-12345678-9 Apellido y Nombre / Razón Social: Francisco Diaz Condición frente al IVA: Responsable Inscripto Domiclio: Condicién de venta: Contado                               [ Producto / Servicio [cantidad — Ju. medida] Precio unit. [%Bonit] imp. Bont. ‘Subtotal 1 Licencia software 2 unidad 3.000,00 5% 300,00 5.700,00 2 Mantenimiento mensual 3 unidad 1.500,00 14% 630,00 3.870,00 3 Soporte técnico 5 unidad 2.000,00 18% 1.800,00 8.200,00   Percepción IIBB: $ 1.500,00 IVA: $3.731,70 Subtotal: $17.770,00 Importe Otros Tributos: $ Importe Total: $23.444,70             Pág. 1/1 5165247793596 ARCA Fecha de Vto. de CAE: 01/05/2025   Comprobante Autorizado Esta Agencia no se responsabllza poros datos Ingrezados an l dea de a operacion",
      "confidence_score": 1.0,
      "metrics": {
        "confidence_score": 1.0,
        "field_accuracy": 0.8823529411764706,
        "cer": 0.7413793103448276,
        "wer": 0.9130434782608695,
        "processing_latency": 8.20776081085205,
        "throughput": 0.12183590909201819,
        "total_fields": 17,
        "correct_fields": 15,
        "missing_fields": 0,
        "incorrect_fields": 0
      },
      "metadata": {
        "file_size": 585134,
        "content_type": "image/jpeg",
        "text_blocks_count": 1,
        "tables_count": 0,
        "figures_count": 0
      }
    },
    {
      "file_path": "C:\\Users\\selel\\OneDrive\\Documentos\\Facultad\\ARPYME\\creacion_dataset\\dataset_facturas\\factura_11.png",
      "filename": "factura_11.png",
      "success": true,
      "processing_time": 8.241556882858276,
      "extracted_fields": {
        "cuit_vendedor": "30-99999999-7",
        "razon_social_comprador": "Alvaro Fernandez",
        "cuit_comprador": "20-12345678-9",
        "fecha_emision": "27/04/2025",
        "subtotal": "26.985,00",
        "importe_total": "34.354,85",
        "numero_factura": "47342647",
        "punto_venta": "0004",
        "tipo_factura": "A",
        "items": [
          {
            "codigo": "1",
            "descripcion": "Análisis datos",
            "cantidad": "4",
            "unidad_medida": "unidad",
            "precio_unitario": "4.000,00",
            "bonificacion": "12%",
            "importe_bonificacion": "1.920,00",
            "subtotal": "14.080,00"
          },
          {
            "codigo": "2",
            "descripcion": "Soporte técnico",
            "cantidad": "5",
            "unidad_medida": "unidad",
            "precio_unitario": "2.000,00",
            "bonificacion": "11%",
            "importe_bonificacion": "1.100,00",
            "subtotal": "8.900,00"
          },
          {
            "codigo": "3",
            "descripcion": "Mantenimiento mensual",
            "cantidad": "1",
            "unidad_medida": "unidad",
            "precio_unitario": "1.500,00",
            "bonificacion": "11%",
            "importe_bonificacion": "495,00",
            "subtotal": "4.005,00"
          }
        ],
        "deuda_impositiva": "7.369,85"
      },
      "extracted_text": "ORIGINAL Global Solutions SA oat | FACTURA Razón Social: Global Solutions SA         Punto de Venta: 0004 Comp.Nro: 47342647 Fecha de Emisión: 27/04/2025            CUIT: 30-99999999-7 Ingresos Brutos: Fecha de Inicio de Actividades: Domicilio Comercial:     Condición frente al IVA:         Período Facturado Desde: Hasta: Fecha de Vto. para el pago: DNI: 20-12345678-9 Apellido y Nombre / Razón Social: Alvaro Fernandez Condición frente al IVA: Responsable Inscripto Domiclio: Condicién de venta: Contado                               [ Producto / Servicio — [u. — preciount [ont] imp. Bont. Subtotal 1 Análisis de datos 4 unidad 4.000,00 12% 1.920,00 14.080,00 2 Soporte técnico 5 unidad 2.000,00 11% 1.100,00 8.900,00 3 Mantenimiento mensual y unidad 1.500,00 11% 495,00 4.005,00   Percepción IIBB: $ 1.500,00 IVA: Subtotal: $26.985,00 Importe Otros Tributos: $ Importe Total: $34.354,85             5165247793596 Fecha de Vto. de CAE: 01/05/2025 Pág. 1/1   Comprobante Autorizado Esta Agencia no se responsabllza poros datos Ingrezados an l dea de a operacion",
      "confidence_score": 0.9333333333333333,
      "metrics": {
        "confidence_score": 0.9333333333333333,
        "field_accuracy": 0.8235294117647058,
        "cer": 0.7008547008547008,
        "wer": 0.8695652173913043,
        "processing_latency": 8.223781108856201,
        "throughput": 0.12159856722391342,
        "total_fields": 17,
        "correct_fields": 14,
        "missing_fields": 0,
        "incorrect_fields": 1
      },
      "metadata": {
        "file_size": 585392,
        "content_type": "image/jpeg",
        "text_blocks_count": 1,
        "tables_count": 0,
        "figures_count": 0
      }
    },
    {
      "file_path": "C:\\Users\\selel\\OneDrive\\Documentos\\Facultad\\ARPYME\\creacion_dataset\\dataset_facturas\\factura_10.png",
      "filename": "factura_10.png",
      "success": true,
      "processing_time": 8.528511762619019,
      "extracted_fields": {
        "razon_social_vendedor": "Digital Future Ltda",
        "cuit_vendedor": "30-99999999-7",
        "razon_social_comprador": "Tomás González",
        "cuit_comprador": "20-12345678-9",
        "condicion_iva_comprador": "Monotributista",
        "condicion_venta": "Contado",
        "fecha_emision": "27/04/2025",
        "subtotal": "43.230,00",
        "importe_total": "54.437,30",
        "iva": "9.078,30",
        "numero_factura": "11658370",
        "punto_venta": "0004",
        "tipo_factura": "A",
        "items": [
          {
            "codigo": "1",
            "descripcion": "Servicio consultoria",
            "cantidad": "1",
            "unidad_medida": "unidad",
            "precio_unitario": "10.000,00",
            "bonificacion": "10%",
            "importe_bonificacion": "1.000,00",
            "subtotal": "9.000,00"
          },
          {
            "codigo": "2",
            "descripcion": "Soporte técnico",
            "cantidad": "5",
            "unidad_medida": "unidad",
            "precio_unitario": "2.000,00",
            "bonificacion": "1%",
            "importe_bonificacion": "100,00",
            "subtotal": "9.900,00"
          },
          {
            "codigo": "4",
            "descripcion": "Instalación servidores",
            "cantidad": "1",
            "unidad_medida": "unidad",
            "precio_unitario": "12.000,00",
            "bonificacion": "11%",
            "importe_bonificacion": "1.320,00",
            "subtotal": "10.680,00"
          },
          {
            "codigo": "3",
            "descripcion": "Implementación red",
            "cantidad": "1",
            "unidad_medida": "unidad",
            "precio_unitario": "5.000,00",
            "bonificacion": "9%",
            "importe_bonificacion": "1.350,00",
            "subtotal": "13.650,00"
          }
        ],
        "deuda_impositiva": "11.207,30"
      },
      "extracted_text": "ORIGINAL   Digital Future Ltda Razón Social: Digital Future Ltda Domicilio Comercial: Condición frente al IVA: Período Facturado Desde:     Hasta: cop.                    Ingresos Brutos: A | FACTURA Punto de Venta: 0004 Fecha de Emisión: 27/04/2025 CUIT: 30-99999999-7 Fecha de Inicio de Actividades: Fecha de Vto. para el pago: Comp. Nro: 11658370         DNI: 20-12345678-9 Condición frente al IVA: Monotributista Condición de venta: Contado Apellido y Nombre / Razón Social: Tomás González Domicilio:                                               [ Producto / Servicio — [u. — preciount [ont] imp. Bont. Subtotal 1 Servicio de consultoria 1 unidad 10.000,00 10% 1.000,00 9.000,00 2 Soporte técnico 5 unidad 2.000,00 1% 100,00 9.900,00 3 Implementación de red y unidad 5.000,00 9% 1.350,00 13.650,00 4 Instalación de servidores 1 unidad 12.000,00 11% 1.320,00 10.680,00 Percepción IIBB: $ 1.500,00 IVA: $9.078,30 Subtotal: $43.230,00 Importe Otros Tributos: $ Importe Total: $54.437,30 Pág. 1/1 5165247793596 Fecha de Vto. de CAE: 01/05/2025 Comprobante Autorizado   Esta Agencia no se responsabllza poros datos Ingrezados an l dea de a operacion",
      "confidence_score": 0.631578947368421,
      "metrics": {
        "confidence_score": 0.631578947368421,
        "field_accuracy": 0.5714285714285714,
        "cer": 0.7007299270072993,
        "wer": 0.8518518518518519,
        "processing_latency": 8.50029444694519,
        "throughput": 0.11764298357445452,
        "total_fields": 21,
        "correct_fields": 12,
        "missing_fields": 0,
        "incorrect_fields": 7
      },
      "metadata": {
        "file_size": 587138,
        "content_type": "image/jpeg",
        "text_blocks_count": 1,
        "tables_count": 0,
        "figures_count": 0
      }
    },
    {
      "file_path": "C:\\Users\\selel\\OneDrive\\Documentos\\Facultad\\ARPYME\\creacion_dataset\\dataset_facturas\\factura_1.png",
      "filename": "factura_1.png",
      "success": true,
      "processing_time": 8.73565125465393,
      "extracted_fields": {
        "razon_social_vendedor": "Digital Experts SRL",
        "cuit_vendedor": "30-99999999-7",
        "razon_social_comprador": "Pedro Martinez",
        "cuit_comprador": "20-12345678-9",
        "condicion_iva_comprador": "Responsable Inscripto",
        "condicion_venta": "Contado",
        "fecha_emision": "27/04/2025",
        "subtotal": "47.445,00",
        "importe_total": "59.241,45",
        "iva": "9.963,45",
        "numero_factura": "60508129",
        "punto_venta": "0004",
        "tipo_factura": "A",
        "items": [
          {
            "codigo": "1",
            "descripcion": "Análisis datos",
            "cantidad": "4",
            "unidad_medida": "unidad",
            "precio_unitario": "4.000,00",
            "bonificacion": "3%",
            "importe_bonificacion": "480,00",
            "subtotal": "15.520,00"
          },
          {
            "codigo": "2",
            "descripcion": "Implementación red",
            "cantidad": "3",
            "unidad_medida": "unidad",
            "precio_unitario": "5.000,00",
            "bonificacion": "2%",
            "importe_bonificacion": "300,00",
            "subtotal": "14.700,00"
          },
          {
            "codigo": "4",
            "descripcion": "Soporte técnico",
            "cantidad": "5",
            "unidad_medida": "unidad",
            "precio_unitario": "2.000,00",
            "bonificacion": "2%",
            "importe_bonificacion": "200,00",
            "subtotal": "9.800,00"
          }
        ],
        "deuda_impositiva": "11.796,45"
      },
      "extracted_text": "ORIGINAL   Digital Experts SRL Razón Social: Digital Experts SRL Domicilio Comercial: Condición frente al IVA: Período Facturado Desde:     Hasta: Fecha de Vto. para el pago: A | FACTURA cop.                    Punto de Venta: 0004 Comp.Nro: 60508129 Fecha de Emisión: 27/04/2025 CUIT: 30-99999999-7 Ingresos Brutos: Fecha de Inicio de Actividades:         DNI: 20-12345678-9 Apellido y Nombre / Razón Social: Pedro Martinez                                               Condición frente al IVA: Responsable Inscripto Domicilio: Condición de venta: Contado [ Producto / servicio — [u. — preciount [ont] imp. Bont. Subtotal 1 Análisis de datos 4 unidad 4.000,00 3% 480,00 15.520,00 2 Implementación de red 3 unidad 5.000,00 2% 300,00 14.700,00 3 Consultoría en IT. + unidad 7.500,00 1% 75,00 7.425,00 4 Soporte técnico 5 unidad 2.000,00 2% 200,00 9.800,00 Percepción IIBB: $ 1.500,00 IVA: $ 9.963,45 Subtotal: $47.445,00 Importe Otros Tributos: $ Importe Total: $59.241,45 ARCA Pág. 1/1 5165247793596 os Fecha de Vto. de CAE: 01/05/2025 Comprobante Autorizado   Esta Agencia no se responsabllza poros datos Ingrezados an l dea de a operacion",
      "confidence_score": 0.5789473684210527,
      "metrics": {
        "confidence_score": 0.5789473684210527,
        "field_accuracy": 0.5238095238095238,
        "cer": 0.732824427480916,
        "wer": 0.8888888888888888,
        "processing_latency": 8.718042135238647,
        "throughput": 0.11470465323377632,
        "total_fields": 21,
        "correct_fields": 11,
        "missing_fields": 4,
        "incorrect_fields": 4
      },
      "metadata": {
        "file_size": 588614,
        "content_type": "image/jpeg",
        "text_blocks_count": 1,
        "tables_count": 0,
        "figures_count": 0
      }
    },
    {
      "file_path": "C:\\Users\\selel\\OneDrive\\Documentos\\Facultad\\ARPYME\\creacion_dataset\\dataset_facturas\\factura_15.png",
      "filename": "factura_15.png",
      "success": true,
      "processing_time": 7.613683700561523,
      "extracted_fields": {
        "razon_social_vendedor": "Tech Innovations Ltda a",
        "cuit_vendedor": "30-99999999-7",
        "razon_social_comprador": "Sofía Ruiz",
        "cuit_comprador": "20-12345678-9",
        "fecha_emision": "27/04/2025",
        "subtotal": "8.070,00",
        "importe_total": "12.075,70",
        "iva": "1.694,70",
        "numero_factura": "64910846",
        "punto_venta": "0004",
        "tipo_factura": "A",
        "items": [
          {
            "codigo": "1",
            "descripcion": "Mantenimiento mensual",
            "cantidad": "3",
            "unidad_medida": "unidad",
            "precio_unitario": "1.500,00",
            "bonificacion": "14%",
            "importe_bonificacion": "630,00",
            "subtotal": "3.870,00"
          },
          {
            "codigo": "2",
            "descripcion": "Capacitación",
            "cantidad": "1",
            "unidad_medida": "unidad",
            "precio_unitario": "5.000,00",
            "bonificacion": "16%",
            "importe_bonificacion": "800,00",
            "subtotal": "4.200,00"
          }
        ],
        "deuda_impositiva": "4.005,70"
      },
      "extracted_text": "ORIGINAL Tech Innovations Ltda a PAGTURA Comp. Nro: 64910846 Punto de Venta: 0004 Fecha de Emisión: 27/04/2025                    Razón Social: Tech Innovations Ltda CUIT: 30-99999999-7 Ingresos Brutos: Fecha de Inicio de Actividades: Domicilio Comercial:     Condición frente al IVA:         Período Facturado Desde: Hasta: Fecha de Vto. para el pago: DNI: 20-12345678-9 Apellido y Nombre / Razón Social: Sofía Ruiz Condición frente al IVA: Responsable Inscripto Domiclio: Condicién de venta: Contado                               [ Producto / Servicio [cantidad — Ju. medida] Precio unit. [%Bonit] imp. Bont. ‘Subtotal 1 Mantenimiento mensual 3 unidad 1.500,00 14% 630,00 3.870,00 2 Capacitación 1 unidad 5.000,00 16% 800,00 4.200,00   Percepción IIBB: $ 1.500,00 IVA: $ 1.694,70 Subtotal: $8.070,00 Importe Otros Tributos: $ Importe Total: $12.075,70           Pág. 1/1 5165247793596 ARCA Fecha de Vto. de CAE: 01/05/2025     Comprobante Autorizado Esta Agencia no se responsabllza poros datos Ingrezados an l dea de a operacion",
      "confidence_score": 1.0,
      "metrics": {
        "confidence_score": 1.0,
        "field_accuracy": 0.8461538461538461,
        "cer": 0.7216494845360825,
        "wer": 1.0,
        "processing_latency": 7.5978844165802,
        "throughput": 0.1316155847037877,
        "total_fields": 13,
        "correct_fields": 11,
        "missing_fields": 0,
        "incorrect_fields": 0
      },
      "metadata": {
        "file_size": 579332,
        "content_type": "image/jpeg",
        "text_blocks_count": 1,
        "tables_count": 0,
        "figures_count": 0
      }
    },
    {
      "file_path": "C:\\Users\\selel\\OneDrive\\Documentos\\Facultad\\ARPYME\\creacion_dataset\\dataset_facturas\\factura_13.png",
      "filename": "factura_13.png",
      "success": true,
      "processing_time": 8.029549837112427,
      "extracted_fields": {
        "cuit_vendedor": "30-99999999-7",
        "razon_social_comprador": "Raúl Gonzalez",
        "cuit_comprador": "20-12345678-9",
        "condicion_iva_comprador": "Monotributista",
        "fecha_emision": "27/04/2025",
        "subtotal": "26.780,00",
        "importe_total": "34.843,80",
        "iva": "5.623,80",
        "numero_factura": "32271872",
        "punto_venta": "0004",
        "tipo_factura": "A",
        "items": [
          {
            "codigo": "1",
            "descripcion": "Licencia software",
            "cantidad": "2",
            "unidad_medida": "unidad",
            "precio_unitario": "3.000,00",
            "bonificacion": "7%",
            "importe_bonificacion": "420,00",
            "subtotal": "5.580,00"
          },
          {
            "codigo": "2",
            "descripcion": "Soporte técnico",
            "cantidad": "5",
            "unidad_medida": "unidad",
            "precio_unitario": "2.000,00",
            "bonificacion": "11%",
            "importe_bonificacion": "1.100,00",
            "subtotal": "8.900,00"
          },
          {
            "codigo": "3",
            "descripcion": "Implementación red",
            "cantidad": "3",
            "unidad_medida": "unidad",
            "precio_unitario": "5.000,00",
            "bonificacion": "18%",
            "importe_bonificacion": "2.700,00",
            "subtotal": "12.300,00"
          }
        ],
        "deuda_impositiva": "8.063,80"
      },
      "extracted_text": "ORIGINAL Tech Consulting SRL ue FACTURA: Razón Social: Tech Consulting SRL         Punto de Venta: 0004 Comp.Nro: 32271872 Fecha de Emisión: 27/04/2025              CUIT: 30-99999999-7 Ingresos Brutos: Fecha de Inicio de Actividades: Domicilio Comercial:    Condición frente al IVA:           Período Facturado Desde: Hasta: Fecha de Vto. para el pago: DNI: 20-12345678-9 Apellido y Nombre / Razón Social: Raúl Gonzalez Condición frente al IVA: Monotributista Domicilio: Condicién de venta: Contado                               [ Producto / Servicio [cantidad — Ju. medida] Precio unit. [%Bonit] imp. Bont. ‘Subtotal 1 Licencia software 2 unidad 3.000,00 7% 420,00 5.580,00 2 Soporte técnico 5 unidad 2.000,00 11% 1.100,00 8.900,00 3 Implementación de red 3 unidad 5.000,00 18% 2.700,00 12.300,00   Percepción IIBB: $ 1.500,00 IVA: $5.623,80 Subtotal: $26.780,00 Importe Otros Tributos: $ Importe Total: $34.843,80             5165247793596 Fecha de Vto. de CAE: 01/05/2025 Pág. 1/1   Comprobante Autorizado Esta Agencia no se responsabllza poros datos Ingrezados an l dea de a operacion",
      "confidence_score": 1.0,
      "metrics": {
        "confidence_score": 1.0,
        "field_accuracy": 0.8823529411764706,
        "cer": 0.7435897435897436,
        "wer": 0.9130434782608695,
        "processing_latency": 8.001868724822998,
        "throughput": 0.12497080799361902,
        "total_fields": 17,
        "correct_fields": 15,
        "missing_fields": 0,
        "incorrect_fields": 0
      },
      "metadata": {
        "file_size": 584991,
        "content_type": "image/jpeg",
        "text_blocks_count": 1,
        "tables_count": 0,
        "figures_count": 0
      }
    },
    {
      "file_path": "C:\\Users\\selel\\OneDrive\\Documentos\\Facultad\\ARPYME\\creacion_dataset\\dataset_facturas\\factura_14.png",
      "filename": "factura_14.png",
      "success": true,
      "processing_time": 8.138529539108276,
      "extracted_fields": {
        "razon_social_vendedor": "Data Systems Ltda",
        "cuit_vendedor": "30-99999999-7",
        "razon_social_comprador": "Ricardo Herrera",
        "cuit_comprador": "20-12345678-9",
        "condicion_iva_comprador": "Responsable Inscripto",
        "condicion_venta": "Contado",
        "fecha_emision": "27/04/2025",
        "subtotal": "26.750,00",
        "importe_total": "34.686,50",
        "iva": "5.617,50",
        "numero_factura": "82389708",
        "punto_venta": "0004",
        "tipo_factura": "A",
        "deuda_impositiva": "7.936,50"
      },
      "extracted_text": "ORIGINAL   Data Systems Ltda Razón Social: Data Systems Ltda Domicilio Comercial: Condición frente al IVA:   A | FACTURA cop.       Punto de Venta: 0004 Comp.Nro: 82389708 Fecha de Emisión: 27/04/2025              CUIT: 30-99999999-7 Ingresos Brutos: Fecha de Inicio de Actividades:                                                      Período Facturado Desde: Hasta: Fecha de Vto. para el pago: DNI: 20-12345678-9 Apellido y Nombre / Razón Social: Ricardo Herrera Condición frente al IVA: Responsable Inscripto Domicilio: Condición de venta: Contado [ Producto / servicio Ju. medida] Precioun [Bont] imp. Bont. Subtotal 1 Implementación de red a, unidad 5.000,00 2% 300,00 14.700,00 2 Capacitación unidad 5.000,00 9% 450,00 4.550,00 3 Consultoría en IT. + unidad 7.500,00 0% 0,00 7.500,00 Percepción IIBB: $ 1.500,00 IVA: $5.617,50 Subtotal: $26.750,00 Importe Otros Tributos: $ Importe Total: $34.686,50 Pág. 1/1 5165247793596   Comprobante Autorizado     Fecha de Vto. de CAE: 01/05/2025 Esta Agencia no se responsabllza poros datos Ingrezados an l dea de a operacion",
      "confidence_score": 0.2,
      "metrics": {
        "confidence_score": 0.2,
        "field_accuracy": 0.17647058823529413,
        "cer": 0.6814159292035398,
        "wer": 1.0,
        "processing_latency": 8.126910209655762,
        "throughput": 0.12304799415796153,
        "total_fields": 17,
        "correct_fields": 3,
        "missing_fields": 12,
        "incorrect_fields": 0
      },
      "metadata": {
        "file_size": 584029,
        "content_type": "image/jpeg",
        "text_blocks_count": 1,
        "tables_count": 0,
        "figures_count": 0
      }
    },
    {
      "file_path": "C:\\Users\\selel\\OneDrive\\Documentos\\Facultad\\ARPYME\\creacion_dataset\\dataset_facturas\\factura_16.png",
      "filename": "factura_16.png",
      "success": true,
      "processing_time": 7.812417507171631,
      "extracted_fields": {
        "razon_social_vendedor": "Digital Future Ltda",
        "cuit_vendedor": "30-99999999-7",
        "razon_social_comprador": "Isabel Torres",
        "cuit_comprador": "20-12345678-9",
        "condicion_iva_comprador": "Monotributista",
        "condicion_venta": "Contado",
        "fecha_emision": "27/04/2025",
        "subtotal": "16.575,00",
        "importe_total": "22.266,75",
        "iva": "3.480,75",
        "numero_factura": "97243187",
        "punto_venta": "0004",
        "tipo_factura": "A",
        "items": [
          {
            "codigo": "1",
            "descripcion": "Consultoria IT",
            "cantidad": "1",
            "unidad_medida": "unidad",
            "precio_unitario": "7.500,00",
            "bonificacion": "7%",
            "importe_bonificacion": "525,00",
            "subtotal": "6.975,00"
          },
          {
            "codigo": "2",
            "descripcion": "Soporte técnico",
            "cantidad": "5",
            "unidad_medida": "unidad",
            "precio_unitario": "2.000,00",
            "bonificacion": "4%",
            "importe_bonificacion": "400,00",
            "subtotal": "9.600,00"
          }
        ],
        "deuda_impositiva": "5.691,75"
      },
      "extracted_text": "ORIGINAL   Digital Future Ltda Razón Social: Digital Future Ltda Domicilio Comercial: Condición frente al IVA:   A | FACTURA cop.       Punto de Venta: 0004              CUIT: 30-99999999-7 Ingresos Brutos: Fecha de Emisión: 27/04/2025 Fecha de Inicio de Actividades: Comp. Nro: 97243187                                                          Período Facturado Desde: Hasta: Fecha de Vto. para el pago: DNI: 20-12345678-9 Apellido y Nombre / Razón Social: Isabel Torres Condición frente al IVA: Monotributista Domicilio: Condición de venta: Contado [ Producto Servicio [Ecamiaad — [u.mecida]— prociount — np. Bont Subtotal 1 Consultoria en IT 1 unidad 7.500,00 7% 525,00 6.975,00 2 Soporte técnico 5 unidad 2.000,00 4% 400,00 9.600,00 Percepción IIBB: $ 1.500,00 IVA: $3.480,75 Subtotal: $16.575,00 Importe Otros Tributos: $ Importe Total: $22.266,75 ARCA Pág. 1/1 5165247793596 os Fecha de Vto. de CAE: 01/05/2025 Comprobante Autorizado   Esta Agencia no se responsabllza poros datos Ingrezados an l dea de a operacion",
      "confidence_score": 1.0,
      "metrics": {
        "confidence_score": 1.0,
        "field_accuracy": 0.8461538461538461,
        "cer": 0.7448979591836735,
        "wer": 0.8947368421052632,
        "processing_latency": 7.801370620727539,
        "throughput": 0.12818260388028355,
        "total_fields": 13,
        "correct_fields": 11,
        "missing_fields": 0,
        "incorrect_fields": 0
      },
      "metadata": {
        "file_size": 578180,
        "content_type": "image/jpeg",
        "text_blocks_count": 1,
        "tables_count": 0,
        "figures_count": 0
      }
    },
    {
      "file_path": "C:\\Users\\selel\\OneDrive\\Documentos\\Facultad\\ARPYME\\creacion_dataset\\dataset_facturas\\factura_18.png",
      "filename": "factura_18.png",
      "success": true,
      "processing_time": 6.582955360412598,
      "extracted_fields": {
        "razon_social_vendedor": "Modern Solutions SA",
        "cuit_vendedor": "30-99999999-7",
        "razon_social_comprador": "Carlos López",
        "cuit_comprador": "20-12345678-9",
        "condicion_iva_comprador": "Monotributista",
        "condicion_venta": "Contado",
        "fecha_emision": "27/04/2025",
        "subtotal": "13.650,00",
        "importe_total": "18.924,50",
        "iva": "2.866,50",
        "numero_factura": "82836149",
        "punto_venta": "0004",
        "tipo_factura": "A",
        "items": [
          {
            "codigo": "1",
            "descripcion": "Implementacién red",
            "cantidad": "3",
            "unidad_medida": "unidad",
            "precio_unitario": "5.000,00",
            "bonificacion": "9%",
            "importe_bonificacion": "1.350,00",
            "subtotal": "13.650,00"
          },
          {
            "codigo": "50",
            "descripcion": "Pág.",
            "cantidad": "111",
            "unidad_medida": "unidad",
            "precio_unitario": "5165247793596",
            "bonificacion": "0%",
            "importe_bonificacion": "0.00",
            "subtotal": "0.00"
          }
        ],
        "deuda_impositiva": "5.274,50"
      },
      "extracted_text": "ORIGINAL   Modern Solutions SA Razón Social: Modern Solutions SA Domicilio Comercial: Condición frente al IVA: Período Facturado Desde:   Hasta: A cop. FACTURA Punto de Venta: 0004 Fecha de Emisión: 27/04/2025                  CUIT: 30-99999999-7 Ingresos Brutos: Fecha de Inicio de Actividades: Fecha de Vto. para el pago:         DNI: 20-12345678-9 Apellido y Nombre / Razón Social: Carlos López                                         Condición frente al IVA: Monotributista Domicilio: Condición de venta: Contado [ Producto / servicio | cantidad — Ju. medida] Precio unit. [Bon] — Bont. ‘Subtotal 1 Implementacién de red 3 unidad 5.000,00 9% 1.350,00 13.650,00 Percepción IIBB: $ 1.500,00 IVA: $2.866,50 Subtotal: $13.650,00 Importe Otros Tributos: $ Importe Total: $18.924,50 Pág. 111 5165247793596 Fecha de Vto. de CAE: 01/05/2025 Comprobante Autorizado     Esta Agencia no se responsabllza poros datos Ingrezados an l dea de a operacion Comp. Nro: 82836149",
      "confidence_score": 1.0,
      "metrics": {
        "confidence_score": 1.0,
        "field_accuracy": 0.7777777777777778,
        "cer": 0.6829268292682927,
        "wer": 1.0,
        "processing_latency": 6.567063331604004,
        "throughput": 0.15227506565796287,
        "total_fields": 9,
        "correct_fields": 7,
        "missing_fields": 0,
        "incorrect_fields": 0
      },
      "metadata": {
        "file_size": 575074,
        "content_type": "image/jpeg",
        "text_blocks_count": 1,
        "tables_count": 0,
        "figures_count": 0
      }
    },
    {
      "file_path": "C:\\Users\\selel\\OneDrive\\Documentos\\Facultad\\ARPYME\\creacion_dataset\\dataset_facturas\\factura_17.png",
      "filename": "factura_17.png",
      "success": true,
      "processing_time": 6.789132356643677,
      "extracted_fields": {
        "cuit_vendedor": "30-99999999-7",
        "razon_social_comprador": "Tomás González",
        "cuit_comprador": "20-12345678-9",
        "fecha_emision": "27/04/2025",
        "subtotal": "18.345,00",
        "importe_total": "23.804,45",
        "iva": "3.852,45",
        "numero_factura": "18768766",
        "punto_venta": "0004",
        "tipo_factura": "A",
        "items": [
          {
            "codigo": "1",
            "descripcion": "Servicio consultoría",
            "cantidad": "1",
            "unidad_medida": "unidad",
            "precio_unitario": "10.000,00",
            "bonificacion": "0%",
            "importe_bonificacion": "0,00",
            "subtotal": "10.000,00"
          },
          {
            "codigo": "2",
            "descripcion": "Mantenimiento mensual",
            "cantidad": "3",
            "unidad_medida": "unidad",
            "precio_unitario": "1.500,00",
            "bonificacion": "19%",
            "importe_bonificacion": "855,00",
            "subtotal": "3.645,00"
          },
          {
            "codigo": "3",
            "descripcion": "Capacitación",
            "cantidad": "1",
            "unidad_medida": "unidad",
            "precio_unitario": "5.000,00",
            "bonificacion": "6%",
            "importe_bonificacion": "300,00",
            "subtotal": "4.700,00"
          }
        ],
        "deuda_impositiva": "5.459,45"
      },
      "extracted_text": "ORIGINAL TechnoConsult SRL eft | FACTURA Razón Social: TechnoConsult SRL         Punto de Venta: 0004 Comp. Nro: 18768766 Fecha de Emisión: 27/04/2025            CUIT: 30-99999999-7 Ingresos Brutos: Fecha de Inicio de Actividades: Domicilio Comercial:    Condición frente al IVA:           Período Facturado Desde: Hasta: Fecha de Vto. para el pago: DNI: 20-12345678-9 Apellido y Nombre / Razón Social: Tomás González Condición frente al IVA: Responsable Inscripto Domiclio: Condicién de venta: Contado                               [ Producto / Servicio [cantidad — Ju. medida] Precio unit. [%Bonit] imp. Bont. ‘Subtotal 1 Servicio de consultoría 1 unidad 10.000,00 0% 0,00 10.000,00 2 Mantenimiento mensual 3 unidad 1.500,00 19% 855,00 3.645,00 3 Capacitación 1 unidad 5.000,00 6% 300,00 4.700,00   Percepción IIBB: $ 1.500,00 IVA: $3.852,45 Subtotal: $18.345,00 Importe Otros Tributos: $ Importe Total: $23.804,45             Pág. 1/1 5165247793596 ARCA Fecha de Vto. de CAE: 01/05/2025   Comprobante Autorizado Esta Agencia no se responsabllza poros datos Ingrezados an l dea de a operacion",
      "confidence_score": 1.0,
      "metrics": {
        "confidence_score": 1.0,
        "field_accuracy": 0.8823529411764706,
        "cer": 0.7543859649122807,
        "wer": 0.9130434782608695,
        "processing_latency": 6.780714273452759,
        "throughput": 0.14747708864759423,
        "total_fields": 17,
        "correct_fields": 15,
        "missing_fields": 0,
        "incorrect_fields": 0
      },
      "metadata": {
        "file_size": 584155,
        "content_type": "image/jpeg",
        "text_blocks_count": 1,
        "tables_count": 0,
        "figures_count": 0
      }
    },
    {
      "file_path": "C:\\Users\\selel\\OneDrive\\Documentos\\Facultad\\ARPYME\\creacion_dataset\\dataset_facturas\\factura_2.png",
      "filename": "factura_2.png",
      "success": true,
      "processing_time": 6.46199369430542,
      "extracted_fields": {
        "cuit_vendedor": "30-99999999-7",
        "razon_social_comprador": "Luis Ramirez",
        "cuit_comprador": "20-12345678-9",
        "condicion_iva_comprador": "Monotributista",
        "fecha_emision": "27/04/2025",
        "subtotal": "20.650,00",
        "importe_total": "27.210,50",
        "iva": "4.336,50",
        "numero_factura": "61210885",
        "punto_venta": "0004",
        "tipo_factura": "A",
        "items": [
          {
            "codigo": "1",
            "descripcion": "Servicio consultoria",
            "cantidad": "1",
            "unidad_medida": "unidad",
            "precio_unitario": "10.000,00",
            "bonificacion": "15%",
            "importe_bonificacion": "1.500,00",
            "subtotal": "8.500,00"
          },
          {
            "codigo": "2",
            "descripcion": "Implementación red",
            "cantidad": "3",
            "unidad_medida": "unidad",
            "precio_unitario": "5.000,00",
            "bonificacion": "19%",
            "importe_bonificacion": "2.850,00",
            "subtotal": "12.150,00"
          }
        ],
        "deuda_impositiva": "6.560,50"
      },
      "extracted_text": "ORIGINAL A | FACTURA cop.                      Software Development SR Razón Social: Software Development SRL Punto de Venta: 0004 Comp.Nro: 61210885 Fecha de Emisión: 27/04/2025 CUIT: 30-99999999-7 Ingresos Brutos: Fecha de Inicio de Actividades: Domicilio Comercial:     Condición frente al IVA:         Período Facturado Desde: Hasta: Fecha de Vto. para el pago: DNI: 20-12345678-9 Apellido y Nombre / Razón Social: Luis Ramirez Condición frente al IVA: Monotributista Domicilio: Condicién de venta: Contado                               [ Producto / Servicio — [u. — preciount [ont] imp. Bont. Subtotal 1 Servicio de consultoria 1 unidad 10.000,00 15% 1.500,00 8.500,00 2 Implementación de red 3 unidad 5.000,00 19% 2.850,00 12.150,00   Percepción IIBB: $ 1.500,00 IVA: $4.336,50 Subtotal: $20.650,00 Importe Otros Tributos: $ Importe Total: $27.210,50           5165247793596 Fecha de Vto. de CAE: 01/05/2025   Pág. 1/1   Comprobante Autorizado Esta Agencia no se responsabllza poros datos Ingrezados an l dea de a operacion",
      "confidence_score": 1.0,
      "metrics": {
        "confidence_score": 1.0,
        "field_accuracy": 0.8461538461538461,
        "cer": 0.693069306930693,
        "wer": 1.0,
        "processing_latency": 6.4602437019348145,
        "throughput": 0.15479292208442608,
        "total_fields": 13,
        "correct_fields": 11,
        "missing_fields": 0,
        "incorrect_fields": 0
      },
      "metadata": {
        "file_size": 581895,
        "content_type": "image/jpeg",
        "text_blocks_count": 1,
        "tables_count": 0,
        "figures_count": 0
      }
    },
    {
      "file_path": "C:\\Users\\selel\\OneDrive\\Documentos\\Facultad\\ARPYME\\creacion_dataset\\dataset_facturas\\factura_19.png",
      "filename": "factura_19.png",
      "success": true,
      "processing_time": 7.164800405502319,
      "extracted_fields": {
        "razon_social_vendedor": "Tech Consulting SRL",
        "cuit_vendedor": "30-99999999-7",
        "razon_social_comprador": "Eva Gómez",
        "cuit_comprador": "20-12345678-9",
        "condicion_iva_comprador": "Monotributista",
        "condicion_venta": "Contado",
        "fecha_emision": "27/04/2025",
        "subtotal": "21.690,00",
        "importe_total": "28.728,90",
        "iva": "4.554,90",
        "numero_factura": "66307980",
        "punto_venta": "0004",
        "tipo_factura": "A",
        "items": [
          {
            "codigo": "3",
            "descripcion": "Implementación red",
            "cantidad": "1",
            "unidad_medida": "unidad",
            "precio_unitario": "5.000,00",
            "bonificacion": "17%",
            "importe_bonificacion": "2.550,00",
            "subtotal": "12.450,00"
          }
        ],
        "deuda_impositiva": "7.038,90"
      },
      "extracted_text": "ORIGINAL   Tech Consulting SRL Razón Social: Tech Consulting SRL Domicilio Comercial: Condición frente al IVA:   A | FACTURA cop.       Punto de Venta: 0004 Comp.Nro: 66307980 Fecha de Emisión: 27/04/2025              CUIT: 30-99999999-7 Ingresos Brutos: Fecha de Inicio de Actividades:                                                   Período Facturado Desde: Hasta: Fecha de Vto. para el pago: DNI: 20-12345678-9 Apellido y Nombre / Razón Social: Eva Gómez Condición frente al IVA: Monotributista Domicilio: Condición de venta: Contado [ Producto / servicio — [u. — preciount [ont] imp. Bont. Subtotal 1 Mantenimiento mensual a, unidad 1.500,00 20% 900,00 3.600,00 2 Licencia software unidad 3.000,00 6% 360,00 5.640,00 3 Implementación de red y unidad 5.000,00 17% 2.550,00 12.450,00 Percepción IIBB: $ 1.500,00 IVA: $4.554,90 Subtotal: $21.690,00 Importe Otros Tributos: $ Importe Total: $28.728,90 Pág. 1/1 5165247793596 Fecha de Vto. de CAE: 01/05/2025 Comprobante Autorizado   Esta Agencia no se responsabllza poros datos Ingrezados an l dea de a operacion",
      "confidence_score": 0.2,
      "metrics": {
        "confidence_score": 0.2,
        "field_accuracy": 0.17647058823529413,
        "cer": 0.7413793103448276,
        "wer": 0.9565217391304348,
        "processing_latency": 7.151500225067139,
        "throughput": 0.13983080032562145,
        "total_fields": 17,
        "correct_fields": 3,
        "missing_fields": 8,
        "incorrect_fields": 4
      },
      "metadata": {
        "file_size": 585400,
        "content_type": "image/jpeg",
        "text_blocks_count": 1,
        "tables_count": 0,
        "figures_count": 0
      }
    },
    {
      "file_path": "C:\\Users\\selel\\OneDrive\\Documentos\\Facultad\\ARPYME\\creacion_dataset\\dataset_facturas\\factura_21.png",
      "filename": "factura_21.png",
      "success": true,
      "processing_time": 5.819928169250488,
      "extracted_fields": {
        "razon_social_vendedor": "Innovative Technologies SA",
        "cuit_vendedor": "30-99999999-7",
        "razon_social_comprador": "Sofía Ruiz",
        "cuit_comprador": "20-12345678-9",
        "condicion_venta": "Contado",
        "fecha_emision": "27/04/2025",
        "subtotal": "14.700,00",
        "importe_total": "14.700,00",
        "numero_factura": "43955141",
        "punto_venta": "0004",
        "tipo_factura": "A",
        "items": [
          {
            "codigo": "1",
            "descripcion": "Implementación red",
            "cantidad": "3",
            "unidad_medida": "unidad",
            "precio_unitario": "5.000,00",
            "bonificacion": "2%",
            "importe_bonificacion": "300,00",
            "subtotal": "14.700,00"
          }
        ],
        "deuda_impositiva": "0,00"
      },
      "extracted_text": "ORIGINAL B | FACTURA cop.                     Innovative Technologies S Punto de Venta: 0004 Comp. Nro: 43955141 Razón Social: Innovative Technologies SA Fecha de Emisión: 27/04/2025 CUIT: 30-99999999-7 Ingresos Brutos: Fecha de Inicio de Actividades: Domicilio Comercial:     Condición frente al IVA:         Período Facturado Desde: Hasta: Fecha de Vto. para el pago: DNI: 20-12345678-9 Apellido y Nombre / Razón Social: Sofía Ruiz Condición frente al IVA: Consumidor Final Domlclllo: Condición de venta: Contado                               [ Producto / servicio | cantidad — Ju. medida] Precio unit. [Bon] — Bont. Subtotal 1 Implementación de red 3 unidad 5.000,00 2% 300,00 14.700,00   Subtotal: $14.700,00 Importe Otros Tributos: $ Importe Total: $14.700,00             5165247793596 Fecha de Vto. de CAE: 01/05/2025 Pag. 1/1   Comprobante Autorizado Esta Agencia no se responsabllza poros datos Ingresados an l dea de a operacion",
      "confidence_score": 1.0,
      "metrics": {
        "confidence_score": 1.0,
        "field_accuracy": 0.7777777777777778,
        "cer": 0.5308641975308642,
        "wer": 0.8666666666666667,
        "processing_latency": 5.8082568645477295,
        "throughput": 0.17216869420906145,
        "total_fields": 9,
        "correct_fields": 7,
        "missing_fields": 0,
        "incorrect_fields": 0
      },
      "metadata": {
        "file_size": 566971,
        "content_type": "image/jpeg",
        "text_blocks_count": 1,
        "tables_count": 0,
        "figures_count": 0
      }
    },
    {
      "file_path": "C:\\Users\\selel\\OneDrive\\Documentos\\Facultad\\ARPYME\\creacion_dataset\\dataset_facturas\\factura_20.png",
      "filename": "factura_20.png",
      "success": true,
      "processing_time": 5.920989036560059,
      "extracted_fields": {
        "razon_social_vendedor": "IT Masters SRL",
        "cuit_vendedor": "30-99999999-7",
        "razon_social_comprador": "Elena Jiménez",
        "cuit_comprador": "20-12345678-9",
        "condicion_iva_comprador": "Monotributista",
        "condicion_venta": "Contado",
        "fecha_emision": "27/04/2025",
        "subtotal": "4.000,00",
        "importe_total": "6.698,00",
        "iva": "840,00",
        "numero_factura": "76819053",
        "punto_venta": "0004",
        "tipo_factura": "A",
        "items": [
          {
            "codigo": "1",
            "descripcion": "Capacitacién",
            "cantidad": "1",
            "unidad_medida": "unidad",
            "precio_unitario": "5.000,00",
            "bonificacion": "20%",
            "importe_bonificacion": "1.000,00",
            "subtotal": "4.000,00"
          },
          {
            "codigo": "00",
            "descripcion": "ARCA Pag.",
            "cantidad": "111",
            "unidad_medida": "unidad",
            "precio_unitario": "5165247793596",
            "bonificacion": "0%",
            "importe_bonificacion": "0.00",
            "subtotal": "0.00"
          }
        ],
        "deuda_impositiva": "2.698,00"
      },
      "extracted_text": "ORIGINAL   IT Masters SRL Razón Social: IT Masters SRL Domicilio Comercial: Condición frente al IVA: Período Facturado Desde:   Hasta: A cop. FACTURA Punto de Venta: 0004 Fecha de Emisión: 27/04/2025                  CUIT: 30-99999999-7 Ingresos Brutos: Fecha de Inicio de Actividades: Fecha de Vto. para el pago:         DNI: 20-12345678-9 Apellido y Nombre / Razón Social: Elena Jiménez                                         Condición frente al IVA: Monotributista Domicilio: Condición de venta: Contado [ Producto / servicio | cantidad — Ju. medida] Precio unit. [Bon] — Bont. ‘Subtotal 1 Capacitacién 1 unidad 5.000,00 20% 1.000,00 4.000,00 Percepción IIBB: $ 1.500,00 IVA: $ 840,00 Subtotal: $4.000,00 Importe Otros Tributos: $ Importe Total: $6.698,00 ARCA Pag. 111 5165247793596 ie Fecha de Vto. de CAE: 01/05/2025 Comprobante Autorizado     Esta Agencia no se responsabllza poros datos Ingrezados an l dea de a operacion Comp. Nro: 76819053",
      "confidence_score": 1.0,
      "metrics": {
        "confidence_score": 1.0,
        "field_accuracy": 0.7777777777777778,
        "cer": 0.675,
        "wer": 1.0,
        "processing_latency": 5.920989036560059,
        "throughput": 0.16889070285814514,
        "total_fields": 9,
        "correct_fields": 7,
        "missing_fields": 0,
        "incorrect_fields": 0
      },
      "metadata": {
        "file_size": 572716,
        "content_type": "image/jpeg",
        "text_blocks_count": 1,
        "tables_count": 0,
        "figures_count": 0
      }
    },
    {
      "file_path": "C:\\Users\\selel\\OneDrive\\Documentos\\Facultad\\ARPYME\\creacion_dataset\\dataset_facturas\\factura_22.png",
      "filename": "factura_22.png",
      "success": true,
      "processing_time": 6.130742788314819,
      "extracted_fields": {
        "razon_social_vendedor": "Consultora IT SRL",
        "cuit_vendedor": "30-99999999-7",
        "razon_social_comprador": "IT SRL",
        "cuit_comprador": "20-12345678-9",
        "condicion_iva_comprador": "Exento",
        "condicion_venta": "Contado",
        "fecha_emision": "27/04/2025",
        "importe_total": "19.065,00",
        "numero_factura": "89797392",
        "punto_venta": "0004",
        "tipo_factura": "A",
        "items": [
          {
            "codigo": "1",
            "descripcion": "Servicio consultoria",
            "cantidad": "1",
            "unidad_medida": "unidad",
            "precio_unitario": "10.000,00",
            "bonificacion": "1%",
            "importe_bonificacion": "100,00",
            "subtotal": "9.900,00"
          }
        ],
        "deuda_impositiva": "0.00"
      },
      "extracted_text": "ORIGINAL   Consultora IT SRL Razón Social: Consultora IT SRL Domicilio Comercial: Condición frente al IVA: Período Facturado Desde: Hasta:   cop.                  Fecha de Vto. para el pago: B | FACTURA Punto de Venta: 0004 Comp.Nro: 89797392 Fecha de Emisión: 27/04/2025 CUIT: 30-99999999-7 Ingresos Brutos: Fecha de Inicio de Actividades:            Condición frente al IVA: Exento Condición de venta: Contado Domlclllo: DNI: 20-12345678-9 Apellido y Nombre / Razón Social: Sofía Ruiz                               [ Producto / servicio — [u. — preciount [ont] imp. Bont. Sublotal 1 Servicio de consultoria 1 unidad 10.000,00 1% 100,00 9.900,00 2 Licencia software unidad 3.000,00 14% 840,00 5.160,00 3 Mantenimiento mensual unidad 1.500,00 11% 495,00 4.005,00   Importe Otros Tributos: $ Importe Total: $19.065,00 Subtotal: $19.065,00             Comprobante Autorizado Esta Agencia no se responsabiliza por os datos Ingres   Pág. 1/1   5165247793596 Fecha de Vto. de CAE: 01/05/2025 1adox enel detal dea operacion",
      "confidence_score": 0.4,
      "metrics": {
        "confidence_score": 0.4,
        "field_accuracy": 0.35294117647058826,
        "cer": 0.6120689655172413,
        "wer": 0.8260869565217391,
        "processing_latency": 6.1225266456604,
        "throughput": 0.16333126140149873,
        "total_fields": 17,
        "correct_fields": 6,
        "missing_fields": 8,
        "incorrect_fields": 1
      },
      "metadata": {
        "file_size": 576630,
        "content_type": "image/jpeg",
        "text_blocks_count": 1,
        "tables_count": 0,
        "figures_count": 0
      }
    }
  ]
}